2.000000 IP 10.1.1.1.49153 > 10.1.1.2.8080: Flags [S], seq 0, win 65535, options [TS val 2000 ecr 0,wscale 2,sackOK,eol], length 0
2.100185 IP 10.1.1.2.8080 > 10.1.1.1.49153: Flags [S.], seq 0, ack 1, win 65535, options [TS val 2050 ecr 2000,wscale 2,sackOK,eol], length 0
2.100185 IP 10.1.1.1.49153 > 10.1.1.2.8080: Flags [.], ack 1, win 32768, options [TS val 2100 ecr 2050,eol], length 0
3.008192 IP 10.1.1.1.49153 > 10.1.1.2.8080: Flags [.], seq 1:537, ack 1, win 32768, options [TS val 3008 ecr 2050,eol], length 536: HTTP
3.009136 IP 10.1.1.1.49153 > 10.1.1.2.8080: Flags [.], seq 537:1025, ack 1, win 32768, options [TS val 3008 ecr 2050,eol], length 488: HTTP
3.016383 IP 10.1.1.1.49153 > 10.1.1.2.8080: Flags [.], seq 1025:1561, ack 1, win 32768, options [TS val 3016 ecr 2050,eol], length 536: HTTP
3.017327 IP 10.1.1.1.49153 > 10.1.1.2.8080: Flags [.], seq 1561:2049, ack 1, win 32768, options [TS val 3016 ecr 2050,eol], length 488: HTTP
3.024575 IP 10.1.1.1.49153 > 10.1.1.2.8080: Flags [.], seq 2049:2585, ack 1, win 32768, options [TS val 3024 ecr 2050,eol], length 536: HTTP
3.025519 IP 10.1.1.1.49153 > 10.1.1.2.8080: Flags [.], seq 2585:3073, ack 1, win 32768, options [TS val 3024 ecr 2050,eol], length 488: HTTP
3.032767 IP 10.1.1.1.49153 > 10.1.1.2.8080: Flags [.], seq 3073:3609, ack 1, win 32768, options [TS val 3032 ecr 2050,eol], length 536: HTTP
3.033711 IP 10.1.1.1.49153 > 10.1.1.2.8080: Flags [.], seq 3609:4097, ack 1, win 32768, options [TS val 3032 ecr 2050,eol], length 488: HTTP
3.040959 IP 10.1.1.1.49153 > 10.1.1.2.8080: Flags [.], seq 4097:4633, ack 1, win 32768, options [TS val 3040 ecr 2050,eol], length 536: HTTP
3.041903 IP 10.1.1.1.49153 > 10.1.1.2.8080: Flags [.], seq 4633:5121, ack 1, win 32768, options [TS val 3040 ecr 2050,eol], length 488: HTTP
3.109222 IP 10.1.1.2.8080 > 10.1.1.1.49153: Flags [.], ack 537, win 32768, options [TS val 3059 ecr 3008,eol], length 0
3.109222 IP 10.1.1.1.49153 > 10.1.1.2.8080: Flags [.], seq 5121:5657, ack 1, win 32768, options [TS val 3109 ecr 3059,eol], length 536: HTTP
3.110166 IP 10.1.1.1.49153 > 10.1.1.2.8080: Flags [.], seq 5657:6193, ack 1, win 32768, options [TS val 3109 ecr 3059,eol], length 536: HTTP
3.117414 IP 10.1.1.2.8080 > 10.1.1.1.49153: Flags [.], ack 1561, win 32768, options [TS val 3067 ecr 3008,eol], length 0
3.117414 IP 10.1.1.1.49153 > 10.1.1.2.8080: Flags [.], seq 6193:6729, ack 1, win 32768, options [TS val 3117 ecr 3067,eol], length 536: HTTP
3.118358 IP 10.1.1.1.49153 > 10.1.1.2.8080: Flags [.], seq 6729:7265, ack 1, win 32768, options [TS val 3117 ecr 3067,eol], length 536: HTTP
3.119302 IP 10.1.1.1.49153 > 10.1.1.2.8080: Flags [.], seq 7265:7801, ack 1, win 32768, options [TS val 3117 ecr 3067,eol], length 536: HTTP
3.125606 IP 10.1.1.2.8080 > 10.1.1.1.49153: Flags [.], ack 2585, win 32768, options [TS val 3075 ecr 3016,eol], length 0
3.125606 IP 10.1.1.1.49153 > 10.1.1.2.8080: Flags [.], seq 7801:8337, ack 1, win 32768, options [TS val 3125 ecr 3075,eol], length 536: HTTP
3.126550 IP 10.1.1.1.49153 > 10.1.1.2.8080: Flags [.], seq 8337:8873, ack 1, win 32768, options [TS val 3125 ecr 3075,eol], length 536: HTTP
3.127494 IP 10.1.1.1.49153 > 10.1.1.2.8080: Flags [.], seq 8873:9409, ack 1, win 32768, options [TS val 3125 ecr 3075,eol], length 536: HTTP
3.134678 IP 10.1.1.2.8080 > 10.1.1.1.49153: Flags [.], ack 2585, win 32768, options [TS val 3084 ecr 3016,sack 1 {3609:4097}], length 0
3.134678 IP 10.1.1.1.49153 > 10.1.1.2.8080: Flags [.], seq 9409:9945, ack 1, win 32768, options [TS val 3134 ecr 3084,eol], length 536: HTTP
3.142003 IP 10.1.1.2.8080 > 10.1.1.1.49153: Flags [.], ack 2585, win 32768, options [TS val 3091 ecr 3016,sack 1 {3609:4633}], length 0
3.142003 IP 10.1.1.1.49153 > 10.1.1.2.8080: Flags [.], seq 9945:10481, ack 1, win 32768, options [TS val 3142 ecr 3091,eol], length 536: HTTP
3.210278 IP 10.1.1.2.8080 > 10.1.1.1.49153: Flags [.], ack 2585, win 32768, options [TS val 3160 ecr 3016,sack 2 {5121:5657}{3609:4633}], length 0
3.210278 IP 10.1.1.1.49153 > 10.1.1.2.8080: Flags [.], seq 2585:3121, ack 1, win 32768, options [TS val 3210 ecr 3160,eol], length 536: HTTP
3.211222 IP 10.1.1.2.8080 > 10.1.1.1.49153: Flags [.], ack 2585, win 32768, options [TS val 3161 ecr 3016,sack 2 {5121:6193}{3609:4633}], length 0
3.218470 IP 10.1.1.2.8080 > 10.1.1.1.49153: Flags [.], ack 2585, win 32768, options [TS val 3168 ecr 3016,sack 2 {5121:6729}{3609:4633}], length 0
3.219414 IP 10.1.1.2.8080 > 10.1.1.1.49153: Flags [.], ack 2585, win 32768, options [TS val 3169 ecr 3016,sack 2 {5121:7265}{3609:4633}], length 0
3.220358 IP 10.1.1.2.8080 > 10.1.1.1.49153: Flags [.], ack 2585, win 32768, options [TS val 3170 ecr 3016,sack 2 {5121:7801}{3609:4633}], length 0
3.226662 IP 10.1.1.2.8080 > 10.1.1.1.49153: Flags [.], ack 2585, win 32768, options [TS val 3176 ecr 3016,sack 2 {5121:8337}{3609:4633}], length 0
3.226662 IP 10.1.1.1.49153 > 10.1.1.2.8080: Flags [.], seq 3121:3609, ack 1, win 32768, options [TS val 3226 ecr 3176,eol], length 488: HTTP
3.227606 IP 10.1.1.2.8080 > 10.1.1.1.49153: Flags [.], ack 2585, win 32768, options [TS val 3177 ecr 3016,sack 2 {5121:8873}{3609:4633}], length 0
3.228550 IP 10.1.1.2.8080 > 10.1.1.1.49153: Flags [.], ack 2585, win 32768, options [TS val 3178 ecr 3016,sack 2 {5121:9409}{3609:4633}], length 0
3.228550 IP 10.1.1.1.49153 > 10.1.1.2.8080: Flags [.], seq 4633:5121, ack 1, win 32768, options [TS val 3228 ecr 3178,eol], length 488: HTTP
3.235734 IP 10.1.1.2.8080 > 10.1.1.1.49153: Flags [.], ack 2585, win 32768, options [TS val 3185 ecr 3016,sack 2 {5121:9945}{3609:4633}], length 0
3.235734 IP 10.1.1.1.49153 > 10.1.1.2.8080: Flags [.], seq 10481:11017, ack 1, win 32768, options [TS val 3235 ecr 3185,eol], length 536: HTTP
3.243059 IP 10.1.1.2.8080 > 10.1.1.1.49153: Flags [.], ack 2585, win 32768, options [TS val 3192 ecr 3016,sack 2 {5121:10481}{3609:4633}], length 0
3.243059 IP 10.1.1.1.49153 > 10.1.1.2.8080: Flags [.], seq 11017:11553, ack 1, win 32768, options [TS val 3243 ecr 3192,eol], length 536: HTTP
3.311334 IP 10.1.1.2.8080 > 10.1.1.1.49153: Flags [.], ack 3121, win 32768, options [TS val 3261 ecr 3210,sack 2 {5121:10481}{3609:4633}], length 0
3.311334 IP 10.1.1.1.49153 > 10.1.1.2.8080: Flags [.], seq 11553:12089, ack 1, win 32768, options [TS val 3311 ecr 3261,eol], length 536: HTTP
3.327628 IP 10.1.1.2.8080 > 10.1.1.1.49153: Flags [.], ack 4633, win 32768, options [TS val 3277 ecr 3226,sack 1 {5121:10481}], length 0
3.327628 IP 10.1.1.1.49153 > 10.1.1.2.8080: Flags [.], seq 12089:12625, ack 1, win 32768, options [TS val 3327 ecr 3277,eol], length 536: HTTP
3.329503 IP 10.1.1.2.8080 > 10.1.1.1.49153: Flags [.], ack 10481, win 32768, options [TS val 3279 ecr 3228,eol], length 0
3.329503 IP 10.1.1.1.49153 > 10.1.1.2.8080: Flags [.], seq 12625:13161, ack 1, win 32768, options [TS val 3329 ecr 3279,eol], length 536: HTTP
3.344089 IP 10.1.1.2.8080 > 10.1.1.1.49153: Flags [.], ack 11553, win 32768, options [TS val 3294 ecr 3235,eol], length 0
3.344089 IP 10.1.1.1.49153 > 10.1.1.2.8080: Flags [.], seq 13161:13697, ack 1, win 32768, options [TS val 3344 ecr 3294,eol], length 536: HTTP
3.345033 IP 10.1.1.1.49153 > 10.1.1.2.8080: Flags [.], seq 13697:14233, ack 1, win 32768, options [TS val 3344 ecr 3294,eol], length 536: HTTP
3.428659 IP 10.1.1.2.8080 > 10.1.1.1.49153: Flags [.], ack 12625, win 32768, options [TS val 3378 ecr 3311,eol], length 0
3.428659 IP 10.1.1.1.49153 > 10.1.1.2.8080: Flags [.], seq 14233:14769, ack 1, win 32768, options [TS val 3428 ecr 3378,eol], length 536: HTTP
3.429603 IP 10.1.1.1.49153 > 10.1.1.2.8080: Flags [.], seq 14769:15305, ack 1, win 32768, options [TS val 3428 ecr 3378,eol], length 536: HTTP
3.446076 IP 10.1.1.2.8080 > 10.1.1.1.49153: Flags [.], ack 13161, win 32768, options [TS val 3395 ecr 3329,sack 1 {13697:14233}], length 0
3.446076 IP 10.1.1.1.49153 > 10.1.1.2.8080: Flags [.], seq 15305:15841, ack 1, win 32768, options [TS val 3446 ecr 3395,eol], length 536: HTTP
3.447020 IP 10.1.1.1.49153 > 10.1.1.2.8080: Flags [.], seq 15841:16377, ack 1, win 32768, options [TS val 3446 ecr 3395,eol], length 536: HTTP
3.529702 IP 10.1.1.2.8080 > 10.1.1.1.49153: Flags [.], ack 13161, win 32768, options [TS val 3479 ecr 3329,sack 1 {13697:14769}], length 0
3.529702 IP 10.1.1.1.49153 > 10.1.1.2.8080: Flags [.], seq 16377:16913, ack 1, win 32768, options [TS val 3529 ecr 3479,eol], length 536: HTTP
3.530646 IP 10.1.1.2.8080 > 10.1.1.1.49153: Flags [.], ack 13161, win 32768, options [TS val 3480 ecr 3329,sack 1 {13697:15305}], length 0
3.530646 IP 10.1.1.1.49153 > 10.1.1.2.8080: Flags [.], seq 13161:13697, ack 1, win 32768, options [TS val 3530 ecr 3480,eol], length 536: HTTP
3.547119 IP 10.1.1.2.8080 > 10.1.1.1.49153: Flags [.], ack 13161, win 32768, options [TS val 3497 ecr 3329,sack 1 {13697:15841}], length 0
3.548063 IP 10.1.1.2.8080 > 10.1.1.1.49153: Flags [.], ack 13161, win 32768, options [TS val 3497 ecr 3329,sack 1 {13697:16377}], length 0
3.630745 IP 10.1.1.2.8080 > 10.1.1.1.49153: Flags [.], ack 13161, win 32768, options [TS val 3580 ecr 3329,sack 1 {13697:16913}], length 0
3.630745 IP 10.1.1.1.49153 > 10.1.1.2.8080: Flags [.], seq 16913:17449, ack 1, win 32768, options [TS val 3630 ecr 3580,eol], length 536: HTTP
3.631676 IP 10.1.1.2.8080 > 10.1.1.1.49153: Flags [.], ack 16913, win 32768, options [TS val 3581 ecr 3530,eol], length 0
3.631689 IP 10.1.1.1.49153 > 10.1.1.2.8080: Flags [.], seq 17449:17985, ack 1, win 32768, options [TS val 3631 ecr 3581,eol], length 536: HTTP
3.732719 IP 10.1.1.2.8080 > 10.1.1.1.49153: Flags [.], ack 17985, win 32768, options [TS val 3682 ecr 3630,eol], length 0
3.732719 IP 10.1.1.1.49153 > 10.1.1.2.8080: Flags [.], seq 17985:18521, ack 1, win 32768, options [TS val 3732 ecr 3682,eol], length 536: HTTP
3.733663 IP 10.1.1.1.49153 > 10.1.1.2.8080: Flags [.], seq 18521:19057, ack 1, win 32768, options [TS val 3732 ecr 3682,eol], length 536: HTTP
3.834694 IP 10.1.1.2.8080 > 10.1.1.1.49153: Flags [.], ack 19057, win 32768, options [TS val 3784 ecr 3732,eol], length 0
3.834694 IP 10.1.1.1.49153 > 10.1.1.2.8080: Flags [.], seq 19057:19593, ack 1, win 32768, options [TS val 3834 ecr 3784,eol], length 536: HTTP
3.835638 IP 10.1.1.1.49153 > 10.1.1.2.8080: Flags [.], seq 19593:20129, ack 1, win 32768, options [TS val 3834 ecr 3784,eol], length 536: HTTP
3.836582 IP 10.1.1.1.49153 > 10.1.1.2.8080: Flags [.], seq 20129:20665, ack 1, win 32768, options [TS val 3834 ecr 3784,eol], length 536: HTTP
3.936668 IP 10.1.1.2.8080 > 10.1.1.1.49153: Flags [.], ack 20129, win 32768, options [TS val 3886 ecr 3834,eol], length 0
3.936668 IP 10.1.1.1.49153 > 10.1.1.2.8080: Flags [.], seq 20665:21201, ack 1, win 32768, options [TS val 3936 ecr 3886,eol], length 536: HTTP
3.937612 IP 10.1.1.1.49153 > 10.1.1.2.8080: Flags [.], seq 21201:21737, ack 1, win 32768, options [TS val 3936 ecr 3886,eol], length 536: HTTP
4.037711 IP 10.1.1.2.8080 > 10.1.1.1.49153: Flags [.], ack 20129, win 32768, options [TS val 3987 ecr 3834,sack 1 {20665:21201}], length 0
4.037711 IP 10.1.1.1.49153 > 10.1.1.2.8080: Flags [.], seq 21737:22273, ack 1, win 32768, options [TS val 4037 ecr 3987,eol], length 536: HTTP
4.038655 IP 10.1.1.2.8080 > 10.1.1.1.49153: Flags [.], ack 20129, win 32768, options [TS val 3988 ecr 3834,sack 1 {20665:21737}], length 0
4.038655 IP 10.1.1.1.49153 > 10.1.1.2.8080: Flags [.], seq 22273:22809, ack 1, win 32768, options [TS val 4038 ecr 3988,eol], length 536: HTTP
4.139711 IP 10.1.1.2.8080 > 10.1.1.1.49153: Flags [.], ack 20129, win 32768, options [TS val 4089 ecr 3834,sack 2 {22273:22809}{20665:21737}], length 0
4.139711 IP 10.1.1.1.49153 > 10.1.1.2.8080: Flags [.], seq 20129:20665, ack 1, win 32768, options [TS val 4139 ecr 4089,eol], length 536: HTTP
4.240755 IP 10.1.1.2.8080 > 10.1.1.1.49153: Flags [.], ack 21737, win 32768, options [TS val 4190 ecr 4139,sack 1 {22273:22809}], length 0
4.240755 IP 10.1.1.1.49153 > 10.1.1.2.8080: Flags [.], seq 22809:23345, ack 1, win 32768, options [TS val 4240 ecr 4190,eol], length 536: HTTP
4.341798 IP 10.1.1.2.8080 > 10.1.1.1.49153: Flags [.], ack 21737, win 32768, options [TS val 4291 ecr 4139,sack 1 {22273:23345}], length 0
4.341798 IP 10.1.1.1.49153 > 10.1.1.2.8080: Flags [.], seq 23345:23881, ack 1, win 32768, options [TS val 4341 ecr 4291,eol], length 536: HTTP
4.442841 IP 10.1.1.2.8080 > 10.1.1.1.49153: Flags [.], ack 21737, win 32768, options [TS val 4392 ecr 4139,sack 1 {22273:23881}], length 0
4.442841 IP 10.1.1.1.49153 > 10.1.1.2.8080: Flags [.], seq 21737:22273, ack 1, win 32768, options [TS val 4442 ecr 4392,eol], length 536: HTTP
4.543871 IP 10.1.1.2.8080 > 10.1.1.1.49153: Flags [.], ack 23881, win 32768, options [TS val 4493 ecr 4442,eol], length 0
4.543871 IP 10.1.1.1.49153 > 10.1.1.2.8080: Flags [.], seq 23881:24417, ack 1, win 32768, options [TS val 4543 ecr 4493,eol], length 536: HTTP
4.544815 IP 10.1.1.1.49153 > 10.1.1.2.8080: Flags [.], seq 24417:24953, ack 1, win 32768, options [TS val 4543 ecr 4493,eol], length 536: HTTP
4.645846 IP 10.1.1.2.8080 > 10.1.1.1.49153: Flags [.], ack 24953, win 32768, options [TS val 4595 ecr 4543,eol], length 0
4.645846 IP 10.1.1.1.49153 > 10.1.1.2.8080: Flags [.], seq 24953:25489, ack 1, win 32768, options [TS val 4645 ecr 4595,eol], length 536: HTTP
4.646790 IP 10.1.1.1.49153 > 10.1.1.2.8080: Flags [.], seq 25489:26025, ack 1, win 32768, options [TS val 4645 ecr 4595,eol], length 536: HTTP
4.747820 IP 10.1.1.2.8080 > 10.1.1.1.49153: Flags [.], ack 26025, win 32768, options [TS val 4697 ecr 4645,eol], length 0
4.747820 IP 10.1.1.1.49153 > 10.1.1.2.8080: Flags [.], seq 26025:26561, ack 1, win 32768, options [TS val 4747 ecr 4697,eol], length 536: HTTP
4.748764 IP 10.1.1.1.49153 > 10.1.1.2.8080: Flags [.], seq 26561:27097, ack 1, win 32768, options [TS val 4747 ecr 4697,eol], length 536: HTTP
4.749708 IP 10.1.1.1.49153 > 10.1.1.2.8080: Flags [.], seq 27097:27633, ack 1, win 32768, options [TS val 4747 ecr 4697,eol], length 536: HTTP
4.849795 IP 10.1.1.2.8080 > 10.1.1.1.49153: Flags [.], ack 27097, win 32768, options [TS val 4799 ecr 4747,eol], length 0
4.849795 IP 10.1.1.1.49153 > 10.1.1.2.8080: Flags [.], seq 27633:28169, ack 1, win 32768, options [TS val 4849 ecr 4799,eol], length 536: HTTP
4.850739 IP 10.1.1.1.49153 > 10.1.1.2.8080: Flags [.], seq 28169:28705, ack 1, win 32768, options [TS val 4849 ecr 4799,eol], length 536: HTTP
4.950825 IP 10.1.1.2.8080 > 10.1.1.1.49153: Flags [.], ack 28169, win 32768, options [TS val 4900 ecr 4747,eol], length 0
4.950825 IP 10.1.1.1.49153 > 10.1.1.2.8080: Flags [.], seq 28705:29241, ack 1, win 32768, options [TS val 4950 ecr 4900,eol], length 536: HTTP
4.951769 IP 10.1.1.1.49153 > 10.1.1.2.8080: Flags [.], seq 29241:29777, ack 1, win 32768, options [TS val 4950 ecr 4900,eol], length 536: HTTP
5.051855 IP 10.1.1.2.8080 > 10.1.1.1.49153: Flags [.], ack 29241, win 32768, options [TS val 5001 ecr 4849,eol], length 0
5.051855 IP 10.1.1.1.49153 > 10.1.1.2.8080: Flags [.], seq 29777:30313, ack 1, win 32768, options [TS val 5051 ecr 5001,eol], length 536: HTTP
5.052799 IP 10.1.1.1.49153 > 10.1.1.2.8080: Flags [.], seq 30313:30849, ack 1, win 32768, options [TS val 5051 ecr 5001,eol], length 536: HTTP
5.053743 IP 10.1.1.1.49153 > 10.1.1.2.8080: Flags [.], seq 30849:31385, ack 1, win 32768, options [TS val 5051 ecr 5001,eol], length 536: HTTP
5.152886 IP 10.1.1.2.8080 > 10.1.1.1.49153: Flags [.], ack 30313, win 32768, options [TS val 5102 ecr 4950,eol], length 0
5.152886 IP 10.1.1.1.49153 > 10.1.1.2.8080: Flags [.], seq 31385:31921, ack 1, win 32768, options [TS val 5152 ecr 5102,eol], length 536: HTTP
5.153830 IP 10.1.1.1.49153 > 10.1.1.2.8080: Flags [.], seq 31921:32457, ack 1, win 32768, options [TS val 5152 ecr 5102,eol], length 536: HTTP
5.154774 IP 10.1.1.2.8080 > 10.1.1.1.49153: Flags [.], ack 31385, win 32768, options [TS val 5104 ecr 5051,eol], length 0
5.154774 IP 10.1.1.1.49153 > 10.1.1.2.8080: Flags [.], seq 32457:32993, ack 1, win 32768, options [TS val 5154 ecr 5104,eol], length 536: HTTP
5.155718 IP 10.1.1.1.49153 > 10.1.1.2.8080: Flags [.], seq 32993:33529, ack 1, win 32768, options [TS val 5154 ecr 5104,eol], length 536: HTTP
5.254873 IP 10.1.1.2.8080 > 10.1.1.1.49153: Flags [.], ack 31385, win 32768, options [TS val 5204 ecr 5051,sack 1 {31921:32457}], length 0
5.254873 IP 10.1.1.1.49153 > 10.1.1.2.8080: Flags [.], seq 33529:34065, ack 1, win 32768, options [TS val 5254 ecr 5204,eol], length 536: HTTP
5.255817 IP 10.1.1.2.8080 > 10.1.1.1.49153: Flags [.], ack 31385, win 32768, options [TS val 5205 ecr 5051,sack 1 {31921:32993}], length 0
5.255817 IP 10.1.1.1.49153 > 10.1.1.2.8080: Flags [.], seq 34065:34601, ack 1, win 32768, options [TS val 5255 ecr 5205,eol], length 536: HTTP
5.256761 IP 10.1.1.2.8080 > 10.1.1.1.49153: Flags [.], ack 31385, win 32768, options [TS val 5206 ecr 5051,sack 1 {31921:33529}], length 0
5.256761 IP 10.1.1.1.49153 > 10.1.1.2.8080: Flags [.], seq 31385:31921, ack 1, win 32768, options [TS val 5256 ecr 5206,eol], length 536: HTTP
5.355916 IP 10.1.1.2.8080 > 10.1.1.1.49153: Flags [.], ack 31385, win 32768, options [TS val 5305 ecr 5051,sack 1 {31921:34065}], length 0
5.356860 IP 10.1.1.2.8080 > 10.1.1.1.49153: Flags [.], ack 31385, win 32768, options [TS val 5306 ecr 5051,sack 1 {31921:34601}], length 0
5.356860 IP 10.1.1.1.49153 > 10.1.1.2.8080: Flags [.], seq 34601:35137, ack 1, win 32768, options [TS val 5356 ecr 5306,eol], length 536: HTTP
5.357791 IP 10.1.1.2.8080 > 10.1.1.1.49153: Flags [.], ack 34601, win 32768, options [TS val 5307 ecr 5256,eol], length 0
5.357804 IP 10.1.1.1.49153 > 10.1.1.2.8080: Flags [.], seq 35137:35673, ack 1, win 32768, options [TS val 5357 ecr 5307,eol], length 536: HTTP
5.458835 IP 10.1.1.2.8080 > 10.1.1.1.49153: Flags [.], ack 35673, win 32768, options [TS val 5408 ecr 5356,eol], length 0
5.458835 IP 10.1.1.1.49153 > 10.1.1.2.8080: Flags [.], seq 35673:36209, ack 1, win 32768, options [TS val 5458 ecr 5408,eol], length 536: HTTP
5.459779 IP 10.1.1.1.49153 > 10.1.1.2.8080: Flags [.], seq 36209:36745, ack 1, win 32768, options [TS val 5458 ecr 5408,eol], length 536: HTTP
5.560809 IP 10.1.1.2.8080 > 10.1.1.1.49153: Flags [.], ack 36745, win 32768, options [TS val 5510 ecr 5458,eol], length 0
5.560809 IP 10.1.1.1.49153 > 10.1.1.2.8080: Flags [.], seq 36745:37281, ack 1, win 32768, options [TS val 5560 ecr 5510,eol], length 536: HTTP
5.561753 IP 10.1.1.1.49153 > 10.1.1.2.8080: Flags [.], seq 37281:37817, ack 1, win 32768, options [TS val 5560 ecr 5510,eol], length 536: HTTP
5.562697 IP 10.1.1.1.49153 > 10.1.1.2.8080: Flags [.], seq 37817:38353, ack 1, win 32768, options [TS val 5560 ecr 5510,eol], length 536: HTTP
5.662783 IP 10.1.1.2.8080 > 10.1.1.1.49153: Flags [.], ack 37817, win 32768, options [TS val 5612 ecr 5560,eol], length 0
5.662783 IP 10.1.1.1.49153 > 10.1.1.2.8080: Flags [.], seq 38353:38889, ack 1, win 32768, options [TS val 5662 ecr 5612,eol], length 536: HTTP
5.663727 IP 10.1.1.1.49153 > 10.1.1.2.8080: Flags [.], seq 38889:39425, ack 1, win 32768, options [TS val 5662 ecr 5612,eol], length 536: HTTP
5.763814 IP 10.1.1.2.8080 > 10.1.1.1.49153: Flags [.], ack 38889, win 32768, options [TS val 5713 ecr 5560,eol], length 0
5.763814 IP 10.1.1.1.49153 > 10.1.1.2.8080: Flags [.], seq 39425:39961, ack 1, win 32768, options [TS val 5763 ecr 5713,eol], length 536: HTTP
5.764758 IP 10.1.1.1.49153 > 10.1.1.2.8080: Flags [.], seq 39961:40497, ack 1, win 32768, options [TS val 5763 ecr 5713,eol], length 536: HTTP
5.864844 IP 10.1.1.2.8080 > 10.1.1.1.49153: Flags [.], ack 39961, win 32768, options [TS val 5814 ecr 5662,eol], length 0
5.864844 IP 10.1.1.1.49153 > 10.1.1.2.8080: Flags [.], seq 40497:41033, ack 1, win 32768, options [TS val 5864 ecr 5814,eol], length 536: HTTP
5.865788 IP 10.1.1.1.49153 > 10.1.1.2.8080: Flags [.], seq 41033:41569, ack 1, win 32768, options [TS val 5864 ecr 5814,eol], length 536: HTTP
5.866732 IP 10.1.1.1.49153 > 10.1.1.2.8080: Flags [.], seq 41569:42105, ack 1, win 32768, options [TS val 5864 ecr 5814,eol], length 536: HTTP
5.965875 IP 10.1.1.2.8080 > 10.1.1.1.49153: Flags [.], ack 41033, win 32768, options [TS val 5915 ecr 5763,eol], length 0
5.965875 IP 10.1.1.1.49153 > 10.1.1.2.8080: Flags [.], seq 42105:42641, ack 1, win 32768, options [TS val 5965 ecr 5915,eol], length 536: HTTP
5.966819 IP 10.1.1.1.49153 > 10.1.1.2.8080: Flags [.], seq 42641:43177, ack 1, win 32768, options [TS val 5965 ecr 5915,eol], length 536: HTTP
5.967763 IP 10.1.1.2.8080 > 10.1.1.1.49153: Flags [.], ack 42105, win 32768, options [TS val 5917 ecr 5864,eol], length 0
5.967763 IP 10.1.1.1.49153 > 10.1.1.2.8080: Flags [.], seq 43177:43713, ack 1, win 32768, options [TS val 5967 ecr 5917,eol], length 536: HTTP
5.968707 IP 10.1.1.1.49153 > 10.1.1.2.8080: Flags [.], seq 43713:44249, ack 1, win 32768, options [TS val 5967 ecr 5917,eol], length 536: HTTP
6.067849 IP 10.1.1.2.8080 > 10.1.1.1.49153: Flags [.], ack 43177, win 32768, options [TS val 6017 ecr 5965,eol], length 0
6.067849 IP 10.1.1.1.49153 > 10.1.1.2.8080: Flags [.], seq 44249:44785, ack 1, win 32768, options [TS val 6067 ecr 6017,eol], length 536: HTTP
6.068793 IP 10.1.1.1.49153 > 10.1.1.2.8080: Flags [.], seq 44785:45321, ack 1, win 32768, options [TS val 6067 ecr 6017,eol], length 536: HTTP
6.069737 IP 10.1.1.2.8080 > 10.1.1.1.49153: Flags [.], ack 44249, win 32768, options [TS val 6019 ecr 5967,eol], length 0
6.069737 IP 10.1.1.1.49153 > 10.1.1.2.8080: Flags [.], seq 45321:45857, ack 1, win 32768, options [TS val 6069 ecr 6019,eol], length 536: HTTP
6.070681 IP 10.1.1.1.49153 > 10.1.1.2.8080: Flags [.], seq 45857:46393, ack 1, win 32768, options [TS val 6069 ecr 6019,eol], length 536: HTTP
6.169836 IP 10.1.1.2.8080 > 10.1.1.1.49153: Flags [.], ack 44249, win 32768, options [TS val 6119 ecr 5967,sack 1 {44785:45321}], length 0
6.169836 IP 10.1.1.1.49153 > 10.1.1.2.8080: Flags [.], seq 46393:46929, ack 1, win 32768, options [TS val 6169 ecr 6119,eol], length 536: HTTP
6.170780 IP 10.1.1.2.8080 > 10.1.1.1.49153: Flags [.], ack 44249, win 32768, options [TS val 6120 ecr 5967,sack 1 {44785:45857}], length 0
6.170780 IP 10.1.1.1.49153 > 10.1.1.2.8080: Flags [.], seq 46929:47465, ack 1, win 32768, options [TS val 6170 ecr 6120,eol], length 536: HTTP
6.171724 IP 10.1.1.2.8080 > 10.1.1.1.49153: Flags [.], ack 44249, win 32768, options [TS val 6121 ecr 5967,sack 1 {44785:46393}], length 0
6.171724 IP 10.1.1.1.49153 > 10.1.1.2.8080: Flags [.], seq 44249:44785, ack 1, win 32768, options [TS val 6171 ecr 6121,eol], length 536: HTTP
6.270879 IP 10.1.1.2.8080 > 10.1.1.1.49153: Flags [.], ack 44249, win 32768, options [TS val 6220 ecr 5967,sack 1 {44785:46929}], length 0
6.271823 IP 10.1.1.2.8080 > 10.1.1.1.49153: Flags [.], ack 44249, win 32768, options [TS val 6221 ecr 5967,sack 1 {44785:47465}], length 0
6.271823 IP 10.1.1.1.49153 > 10.1.1.2.8080: Flags [.], seq 47465:48001, ack 1, win 32768, options [TS val 6271 ecr 6221,eol], length 536: HTTP
6.272755 IP 10.1.1.2.8080 > 10.1.1.1.49153: Flags [.], ack 47465, win 32768, options [TS val 6222 ecr 6171,eol], length 0
6.272767 IP 10.1.1.1.49153 > 10.1.1.2.8080: Flags [.], seq 48001:48537, ack 1, win 32768, options [TS val 6272 ecr 6222,eol], length 536: HTTP
6.373798 IP 10.1.1.2.8080 > 10.1.1.1.49153: Flags [.], ack 48537, win 32768, options [TS val 6323 ecr 6271,eol], length 0
6.373798 IP 10.1.1.1.49153 > 10.1.1.2.8080: Flags [.], seq 48537:49073, ack 1, win 32768, options [TS val 6373 ecr 6323,eol], length 536: HTTP
6.374742 IP 10.1.1.1.49153 > 10.1.1.2.8080: Flags [.], seq 49073:49609, ack 1, win 32768, options [TS val 6373 ecr 6323,eol], length 536: HTTP
6.475772 IP 10.1.1.2.8080 > 10.1.1.1.49153: Flags [.], ack 49609, win 32768, options [TS val 6425 ecr 6373,eol], length 0
6.475772 IP 10.1.1.1.49153 > 10.1.1.2.8080: Flags [.], seq 49609:50145, ack 1, win 32768, options [TS val 6475 ecr 6425,eol], length 536: HTTP
6.476716 IP 10.1.1.1.49153 > 10.1.1.2.8080: Flags [.], seq 50145:50681, ack 1, win 32768, options [TS val 6475 ecr 6425,eol], length 536: HTTP
6.477660 IP 10.1.1.1.49153 > 10.1.1.2.8080: Flags [.], seq 50681:51217, ack 1, win 32768, options [TS val 6475 ecr 6425,eol], length 536: HTTP
6.577747 IP 10.1.1.2.8080 > 10.1.1.1.49153: Flags [.], ack 50681, win 32768, options [TS val 6527 ecr 6475,eol], length 0
6.577747 IP 10.1.1.1.49153 > 10.1.1.2.8080: Flags [.], seq 51217:51753, ack 1, win 32768, options [TS val 6577 ecr 6527,eol], length 536: HTTP
6.578691 IP 10.1.1.1.49153 > 10.1.1.2.8080: Flags [.], seq 51753:52289, ack 1, win 32768, options [TS val 6577 ecr 6527,eol], length 536: HTTP
6.678777 IP 10.1.1.2.8080 > 10.1.1.1.49153: Flags [.], ack 51753, win 32768, options [TS val 6628 ecr 6475,eol], length 0
6.678777 IP 10.1.1.1.49153 > 10.1.1.2.8080: Flags [.], seq 52289:52825, ack 1, win 32768, options [TS val 6678 ecr 6628,eol], length 536: HTTP
6.679721 IP 10.1.1.1.49153 > 10.1.1.2.8080: Flags [.], seq 52825:53361, ack 1, win 32768, options [TS val 6678 ecr 6628,eol], length 536: HTTP
6.779807 IP 10.1.1.2.8080 > 10.1.1.1.49153: Flags [.], ack 52825, win 32768, options [TS val 6729 ecr 6577,eol], length 0
6.779807 IP 10.1.1.1.49153 > 10.1.1.2.8080: Flags [.], seq 53361:53897, ack 1, win 32768, options [TS val 6779 ecr 6729,eol], length 536: HTTP
6.780751 IP 10.1.1.1.49153 > 10.1.1.2.8080: Flags [.], seq 53897:54433, ack 1, win 32768, options [TS val 6779 ecr 6729,eol], length 536: HTTP
6.781695 IP 10.1.1.1.49153 > 10.1.1.2.8080: Flags [.], seq 54433:54969, ack 1, win 32768, options [TS val 6779 ecr 6729,eol], length 536: HTTP
6.880838 IP 10.1.1.2.8080 > 10.1.1.1.49153: Flags [.], ack 53897, win 32768, options [TS val 6830 ecr 6678,eol], length 0
6.880838 IP 10.1.1.1.49153 > 10.1.1.2.8080: Flags [.], seq 54969:55505, ack 1, win 32768, options [TS val 6880 ecr 6830,eol], length 536: HTTP
6.881782 IP 10.1.1.1.49153 > 10.1.1.2.8080: Flags [.], seq 55505:56041, ack 1, win 32768, options [TS val 6880 ecr 6830,eol], length 536: HTTP
6.882739 IP 10.1.1.2.8080 > 10.1.1.1.49153: Flags [.], ack 53897, win 32768, options [TS val 6832 ecr 6678,sack 1 {54433:54969}], length 0
6.882739 IP 10.1.1.1.49153 > 10.1.1.2.8080: Flags [.], seq 56041:56577, ack 1, win 32768, options [TS val 6882 ecr 6832,eol], length 536: HTTP
6.981881 IP 10.1.1.2.8080 > 10.1.1.1.49153: Flags [.], ack 53897, win 32768, options [TS val 6931 ecr 6678,sack 1 {54433:55505}], length 0
6.981881 IP 10.1.1.1.49153 > 10.1.1.2.8080: Flags [.], seq 56577:57113, ack 1, win 32768, options [TS val 6981 ecr 6931,eol], length 536: HTTP
6.982825 IP 10.1.1.2.8080 > 10.1.1.1.49153: Flags [.], ack 53897, win 32768, options [TS val 6932 ecr 6678,sack 1 {54433:56041}], length 0
6.982825 IP 10.1.1.1.49153 > 10.1.1.2.8080: Flags [.], seq 53897:54433, ack 1, win 32768, options [TS val 6982 ecr 6932,eol], length 536: HTTP
6.983782 IP 10.1.1.2.8080 > 10.1.1.1.49153: Flags [.], ack 53897, win 32768, options [TS val 6933 ecr 6678,sack 1 {54433:56577}], length 0
7.082924 IP 10.1.1.2.8080 > 10.1.1.1.49153: Flags [.], ack 53897, win 32768, options [TS val 7032 ecr 6678,sack 1 {54433:57113}], length 0
7.082924 IP 10.1.1.1.49153 > 10.1.1.2.8080: Flags [.], seq 57113:57649, ack 1, win 32768, options [TS val 7082 ecr 7032,eol], length 536: HTTP
7.083855 IP 10.1.1.2.8080 > 10.1.1.1.49153: Flags [.], ack 57113, win 32768, options [TS val 7033 ecr 6982,eol], length 0
7.083868 IP 10.1.1.1.49153 > 10.1.1.2.8080: Flags [.], seq 57649:58185, ack 1, win 32768, options [TS val 7083 ecr 7033,eol], length 536: HTTP
7.184911 IP 10.1.1.2.8080 > 10.1.1.1.49153: Flags [.], ack 57113, win 32768, options [TS val 7134 ecr 6982,sack 1 {57649:58185}], length 0
7.184911 IP 10.1.1.1.49153 > 10.1.1.2.8080: Flags [.], seq 58185:58721, ack 1, win 32768, options [TS val 7184 ecr 7134,eol], length 536: HTTP
7.285955 IP 10.1.1.2.8080 > 10.1.1.1.49153: Flags [.], ack 57113, win 32768, options [TS val 7235 ecr 6982,sack 1 {57649:58721}], length 0
7.285955 IP 10.1.1.1.49153 > 10.1.1.2.8080: Flags [.], seq 58721:59257, ack 1, win 32768, options [TS val 7285 ecr 7235,eol], length 536: HTTP
7.386998 IP 10.1.1.2.8080 > 10.1.1.1.49153: Flags [.], ack 57113, win 32768, options [TS val 7336 ecr 6982,sack 1 {57649:59257}], length 0
7.386998 IP 10.1.1.1.49153 > 10.1.1.2.8080: Flags [.], seq 57113:57649, ack 1, win 32768, options [TS val 7386 ecr 7336,eol], length 536: HTTP
7.488028 IP 10.1.1.2.8080 > 10.1.1.1.49153: Flags [.], ack 59257, win 32768, options [TS val 7437 ecr 7386,eol], length 0
7.488028 IP 10.1.1.1.49153 > 10.1.1.2.8080: Flags [.], seq 59257:59793, ack 1, win 32768, options [TS val 7488 ecr 7437,eol], length 536: HTTP
7.488972 IP 10.1.1.1.49153 > 10.1.1.2.8080: Flags [.], seq 59793:60329, ack 1, win 32768, options [TS val 7488 ecr 7437,eol], length 536: HTTP
7.590003 IP 10.1.1.2.8080 > 10.1.1.1.49153: Flags [.], ack 60329, win 32768, options [TS val 7539 ecr 7488,eol], length 0
7.590003 IP 10.1.1.1.49153 > 10.1.1.2.8080: Flags [.], seq 60329:60865, ack 1, win 32768, options [TS val 7590 ecr 7539,eol], length 536: HTTP
7.590947 IP 10.1.1.1.49153 > 10.1.1.2.8080: Flags [.], seq 60865:61401, ack 1, win 32768, options [TS val 7590 ecr 7539,eol], length 536: HTTP
7.891033 IP 10.1.1.2.8080 > 10.1.1.1.49153: Flags [.], ack 60865, win 32768, options [TS val 7840 ecr 7590,eol], length 0
7.891033 IP 10.1.1.1.49153 > 10.1.1.2.8080: Flags [.], seq 61401:61937, ack 1, win 32768, options [TS val 7891 ecr 7840,eol], length 536: HTTP
7.891977 IP 10.1.1.1.49153 > 10.1.1.2.8080: Flags [.], seq 61937:62473, ack 1, win 32768, options [TS val 7891 ecr 7840,eol], length 536: HTTP
7.992076 IP 10.1.1.2.8080 > 10.1.1.1.49153: Flags [.], ack 60865, win 32768, options [TS val 7941 ecr 7590,sack 1 {61401:61937}], length 0
7.992076 IP 10.1.1.1.49153 > 10.1.1.2.8080: Flags [.], seq 62473:63009, ack 1, win 32768, options [TS val 7992 ecr 7941,eol], length 536: HTTP
7.993020 IP 10.1.1.2.8080 > 10.1.1.1.49153: Flags [.], ack 60865, win 32768, options [TS val 7942 ecr 7590,sack 1 {61401:62473}], length 0
7.993020 IP 10.1.1.1.49153 > 10.1.1.2.8080: Flags [.], seq 63009:63545, ack 1, win 32768, options [TS val 7993 ecr 7942,eol], length 536: HTTP
8.093119 IP 10.1.1.2.8080 > 10.1.1.1.49153: Flags [.], ack 60865, win 32768, options [TS val 8043 ecr 7590,sack 1 {61401:63009}], length 0
8.093119 IP 10.1.1.1.49153 > 10.1.1.2.8080: Flags [.], seq 60865:61401, ack 1, win 32768, options [TS val 8093 ecr 8043,eol], length 536: HTTP
8.094063 IP 10.1.1.2.8080 > 10.1.1.1.49153: Flags [.], ack 60865, win 32768, options [TS val 8043 ecr 7590,sack 1 {61401:63545}], length 0
8.094063 IP 10.1.1.1.49153 > 10.1.1.2.8080: Flags [.], seq 63545:64081, ack 1, win 32768, options [TS val 8094 ecr 8043,eol], length 536: HTTP
8.194150 IP 10.1.1.2.8080 > 10.1.1.1.49153: Flags [.], ack 63545, win 32768, options [TS val 8144 ecr 8093,eol], length 0
8.194150 IP 10.1.1.1.49153 > 10.1.1.2.8080: Flags [.], seq 64081:64617, ack 1, win 32768, options [TS val 8194 ecr 8144,eol], length 536: HTTP
8.295180 IP 10.1.1.2.8080 > 10.1.1.1.49153: Flags [.], ack 64617, win 32768, options [TS val 8245 ecr 8094,eol], length 0
8.295180 IP 10.1.1.1.49153 > 10.1.1.2.8080: Flags [.], seq 64617:65153, ack 1, win 32768, options [TS val 8295 ecr 8245,eol], length 536: HTTP
8.296124 IP 10.1.1.1.49153 > 10.1.1.2.8080: Flags [.], seq 65153:65689, ack 1, win 32768, options [TS val 8295 ecr 8245,eol], length 536: HTTP
8.397155 IP 10.1.1.2.8080 > 10.1.1.1.49153: Flags [.], ack 65689, win 32768, options [TS val 8347 ecr 8295,eol], length 0
8.397155 IP 10.1.1.1.49153 > 10.1.1.2.8080: Flags [.], seq 65689:66225, ack 1, win 32768, options [TS val 8397 ecr 8347,eol], length 536: HTTP
8.398099 IP 10.1.1.1.49153 > 10.1.1.2.8080: Flags [.], seq 66225:66761, ack 1, win 32768, options [TS val 8397 ecr 8347,eol], length 536: HTTP
8.399043 IP 10.1.1.1.49153 > 10.1.1.2.8080: Flags [.], seq 66761:67297, ack 1, win 32768, options [TS val 8397 ecr 8347,eol], length 536: HTTP
8.499129 IP 10.1.1.2.8080 > 10.1.1.1.49153: Flags [.], ack 66761, win 32768, options [TS val 8449 ecr 8397,eol], length 0
8.499129 IP 10.1.1.1.49153 > 10.1.1.2.8080: Flags [.], seq 67297:67833, ack 1, win 32768, options [TS val 8499 ecr 8449,eol], length 536: HTTP
8.500073 IP 10.1.1.1.49153 > 10.1.1.2.8080: Flags [.], seq 67833:68369, ack 1, win 32768, options [TS val 8499 ecr 8449,eol], length 536: HTTP
8.600172 IP 10.1.1.2.8080 > 10.1.1.1.49153: Flags [.], ack 66761, win 32768, options [TS val 8550 ecr 8397,sack 1 {67297:67833}], length 0
8.600172 IP 10.1.1.1.49153 > 10.1.1.2.8080: Flags [.], seq 68369:68905, ack 1, win 32768, options [TS val 8600 ecr 8550,eol], length 536: HTTP
8.601116 IP 10.1.1.2.8080 > 10.1.1.1.49153: Flags [.], ack 66761, win 32768, options [TS val 8551 ecr 8397,sack 1 {67297:68369}], length 0
8.601116 IP 10.1.1.1.49153 > 10.1.1.2.8080: Flags [.], seq 68905:69441, ack 1, win 32768, options [TS val 8601 ecr 8551,eol], length 536: HTTP
8.701215 IP 10.1.1.2.8080 > 10.1.1.1.49153: Flags [.], ack 66761, win 32768, options [TS val 8651 ecr 8397,sack 1 {67297:68905}], length 0
8.701215 IP 10.1.1.1.49153 > 10.1.1.2.8080: Flags [.], seq 66761:67297, ack 1, win 32768, options [TS val 8701 ecr 8651,eol], length 536: HTTP
8.702159 IP 10.1.1.2.8080 > 10.1.1.1.49153: Flags [.], ack 66761, win 32768, options [TS val 8652 ecr 8397,sack 1 {67297:69441}], length 0
8.702159 IP 10.1.1.1.49153 > 10.1.1.2.8080: Flags [.], seq 69441:69977, ack 1, win 32768, options [TS val 8702 ecr 8652,eol], length 536: HTTP
8.802246 IP 10.1.1.2.8080 > 10.1.1.1.49153: Flags [.], ack 69441, win 32768, options [TS val 8752 ecr 8701,eol], length 0
8.802246 IP 10.1.1.1.49153 > 10.1.1.2.8080: Flags [.], seq 69977:70513, ack 1, win 32768, options [TS val 8802 ecr 8752,eol], length 536: HTTP
8.903289 IP 10.1.1.2.8080 > 10.1.1.1.49153: Flags [.], ack 69441, win 32768, options [TS val 8853 ecr 8701,sack 1 {69977:70513}], length 0
8.903289 IP 10.1.1.1.49153 > 10.1.1.2.8080: Flags [.], seq 70513:71049, ack 1, win 32768, options [TS val 8903 ecr 8853,eol], length 536: HTTP
9.004332 IP 10.1.1.2.8080 > 10.1.1.1.49153: Flags [.], ack 69441, win 32768, options [TS val 8954 ecr 8701,sack 1 {69977:71049}], length 0
9.004332 IP 10.1.1.1.49153 > 10.1.1.2.8080: Flags [.], seq 71049:71585, ack 1, win 32768, options [TS val 9004 ecr 8954,eol], length 536: HTTP
9.105375 IP 10.1.1.2.8080 > 10.1.1.1.49153: Flags [.], ack 69441, win 32768, options [TS val 9055 ecr 8701,sack 1 {69977:71585}], length 0
9.105375 IP 10.1.1.1.49153 > 10.1.1.2.8080: Flags [.], seq 69441:69977, ack 1, win 32768, options [TS val 9105 ecr 9055,eol], length 536: HTTP
9.206406 IP 10.1.1.2.8080 > 10.1.1.1.49153: Flags [.], ack 71585, win 32768, options [TS val 9156 ecr 9105,eol], length 0
9.206406 IP 10.1.1.1.49153 > 10.1.1.2.8080: Flags [.], seq 71585:72121, ack 1, win 32768, options [TS val 9206 ecr 9156,eol], length 536: HTTP
9.207350 IP 10.1.1.1.49153 > 10.1.1.2.8080: Flags [.], seq 72121:72657, ack 1, win 32768, options [TS val 9206 ecr 9156,eol], length 536: HTTP
9.308393 IP 10.1.1.2.8080 > 10.1.1.1.49153: Flags [.], ack 71585, win 32768, options [TS val 9258 ecr 9105,sack 1 {72121:72657}], length 0
9.308393 IP 10.1.1.1.49153 > 10.1.1.2.8080: Flags [.], seq 72657:73193, ack 1, win 32768, options [TS val 9308 ecr 9258,eol], length 536: HTTP
10.206406 IP 10.1.1.1.49153 > 10.1.1.2.8080: Flags [.], seq 71585:72121, ack 1, win 32768, options [TS val 10206 ecr 9258,eol], length 536: HTTP
10.307436 IP 10.1.1.2.8080 > 10.1.1.1.49153: Flags [.], ack 72657, win 32768, options [TS val 10257 ecr 10206,eol], length 0
10.307436 IP 10.1.1.1.49153 > 10.1.1.2.8080: Flags [.], seq 72657:73193, ack 1, win 32768, options [TS val 10307 ecr 10257,eol], length 536: HTTP
10.308380 IP 10.1.1.1.49153 > 10.1.1.2.8080: Flags [.], seq 73193:73729, ack 1, win 32768, options [TS val 10307 ecr 10257,eol], length 536: HTTP
10.409411 IP 10.1.1.2.8080 > 10.1.1.1.49153: Flags [.], ack 73729, win 32768, options [TS val 10359 ecr 10307,eol], length 0
10.409411 IP 10.1.1.1.49153 > 10.1.1.2.8080: Flags [.], seq 73729:74265, ack 1, win 32768, options [TS val 10409 ecr 10359,eol], length 536: HTTP
10.410355 IP 10.1.1.1.49153 > 10.1.1.2.8080: Flags [.], seq 74265:74801, ack 1, win 32768, options [TS val 10409 ecr 10359,eol], length 536: HTTP
10.511385 IP 10.1.1.2.8080 > 10.1.1.1.49153: Flags [.], ack 74801, win 32768, options [TS val 10461 ecr 10409,eol], length 0
10.511385 IP 10.1.1.1.49153 > 10.1.1.2.8080: Flags [.], seq 74801:75337, ack 1, win 32768, options [TS val 10511 ecr 10461,eol], length 536: HTTP
10.512329 IP 10.1.1.1.49153 > 10.1.1.2.8080: Flags [.], seq 75337:75873, ack 1, win 32768, options [TS val 10511 ecr 10461,eol], length 536: HTTP
10.513273 IP 10.1.1.1.49153 > 10.1.1.2.8080: Flags [.], seq 75873:76409, ack 1, win 32768, options [TS val 10511 ecr 10461,eol], length 536: HTTP
10.613359 IP 10.1.1.2.8080 > 10.1.1.1.49153: Flags [.], ack 75873, win 32768, options [TS val 10563 ecr 10511,eol], length 0
10.613359 IP 10.1.1.1.49153 > 10.1.1.2.8080: Flags [.], seq 76409:76945, ack 1, win 32768, options [TS val 10613 ecr 10563,eol], length 536: HTTP
10.614303 IP 10.1.1.1.49153 > 10.1.1.2.8080: Flags [.], seq 76945:77481, ack 1, win 32768, options [TS val 10613 ecr 10563,eol], length 536: HTTP
10.714390 IP 10.1.1.2.8080 > 10.1.1.1.49153: Flags [.], ack 76945, win 32768, options [TS val 10664 ecr 10511,eol], length 0
10.714390 IP 10.1.1.1.49153 > 10.1.1.2.8080: Flags [.], seq 77481:78017, ack 1, win 32768, options [TS val 10714 ecr 10664,eol], length 536: HTTP
10.715334 IP 10.1.1.1.49153 > 10.1.1.2.8080: Flags [.], seq 78017:78553, ack 1, win 32768, options [TS val 10714 ecr 10664,eol], length 536: HTTP
10.815420 IP 10.1.1.2.8080 > 10.1.1.1.49153: Flags [.], ack 78017, win 32768, options [TS val 10765 ecr 10613,eol], length 0
10.815420 IP 10.1.1.1.49153 > 10.1.1.2.8080: Flags [.], seq 78553:79089, ack 1, win 32768, options [TS val 10815 ecr 10765,eol], length 536: HTTP
10.816364 IP 10.1.1.1.49153 > 10.1.1.2.8080: Flags [.], seq 79089:79625, ack 1, win 32768, options [TS val 10815 ecr 10765,eol], length 536: HTTP
10.817308 IP 10.1.1.1.49153 > 10.1.1.2.8080: Flags [.], seq 79625:80161, ack 1, win 32768, options [TS val 10815 ecr 10765,eol], length 536: HTTP
10.916451 IP 10.1.1.2.8080 > 10.1.1.1.49153: Flags [.], ack 79089, win 32768, options [TS val 10866 ecr 10714,eol], length 0
10.916451 IP 10.1.1.1.49153 > 10.1.1.2.8080: Flags [.], seq 80161:80697, ack 1, win 32768, options [TS val 10916 ecr 10866,eol], length 536: HTTP
10.917395 IP 10.1.1.1.49153 > 10.1.1.2.8080: Flags [.], seq 80697:81233, ack 1, win 32768, options [TS val 10916 ecr 10866,eol], length 536: HTTP
11.017494 IP 10.1.1.2.8080 > 10.1.1.1.49153: Flags [.], ack 79625, win 32768, options [TS val 10967 ecr 10815,sack 1 {80161:80697}], length 0
11.017494 IP 10.1.1.1.49153 > 10.1.1.2.8080: Flags [.], seq 81233:81769, ack 1, win 32768, options [TS val 11017 ecr 10967,eol], length 536: HTTP
11.018438 IP 10.1.1.2.8080 > 10.1.1.1.49153: Flags [.], ack 79625, win 32768, options [TS val 10968 ecr 10815,sack 1 {80161:81233}], length 0
11.018438 IP 10.1.1.1.49153 > 10.1.1.2.8080: Flags [.], seq 81769:82305, ack 1, win 32768, options [TS val 11017 ecr 10967,eol], length 536: HTTP
11.019382 IP 10.1.1.1.49153 > 10.1.1.2.8080: Flags [.], seq 82305:82841, ack 1, win 32768, options [TS val 11018 ecr 10968,eol], length 536: HTTP
11.118537 IP 10.1.1.2.8080 > 10.1.1.1.49153: Flags [.], ack 79625, win 32768, options [TS val 11068 ecr 10815,sack 1 {80161:81769}], length 0
11.118537 IP 10.1.1.1.49153 > 10.1.1.2.8080: Flags [.], seq 79625:80161, ack 1, win 32768, options [TS val 11118 ecr 11068,eol], length 536: HTTP
11.119481 IP 10.1.1.2.8080 > 10.1.1.1.49153: Flags [.], ack 79625, win 32768, options [TS val 11069 ecr 10815,sack 1 {80161:82305}], length 0
11.120425 IP 10.1.1.2.8080 > 10.1.1.1.49153: Flags [.], ack 79625, win 32768, options [TS val 11070 ecr 10815,sack 1 {80161:82841}], length 0
11.120425 IP 10.1.1.1.49153 > 10.1.1.2.8080: Flags [.], seq 82841:83377, ack 1, win 32768, options [TS val 11120 ecr 11070,eol], length 536: HTTP
