2.003000 ARP, Request who-has 10.1.2.1 (ff:ff:ff:ff:ff:ff) tell 10.1.2.4, length 50
2.003024 ARP, Reply 10.1.2.1 is-at 00:00:00:00:00:03, length 50
2.003024 IP 10.1.2.4.49153 > 10.1.3.4.8080: Flags [S], seq 0, win 65535, options [TS val 2000 ecr 0,wscale 2,sackOK,eol], length 0
2.115310 ARP, Request who-has 10.1.2.4 (ff:ff:ff:ff:ff:ff) tell 10.1.2.1, length 50
2.115310 ARP, Reply 10.1.2.4 is-at 00:00:00:00:00:06, length 50
2.115336 IP 10.1.3.4.8080 > 10.1.2.4.49153: Flags [S.], seq 0, ack 1, win 65535, options [TS val 2059 ecr 2000,wscale 2,sackOK,eol], length 0
2.115336 IP 10.1.2.4.49153 > 10.1.3.4.8080: Flags [.], ack 1, win 32768, options [TS val 2115 ecr 2059,eol], length 0
3.008192 IP 10.1.2.4.49153 > 10.1.3.4.8080: Flags [.], seq 1:537, ack 1, win 32768, options [TS val 3008 ecr 2059,eol], length 536: HTTP
3.008241 IP 10.1.2.4.49153 > 10.1.3.4.8080: Flags [.], seq 537:1025, ack 1, win 32768, options [TS val 3008 ecr 2059,eol], length 488: HTTP
3.016383 IP 10.1.2.4.49153 > 10.1.3.4.8080: Flags [.], seq 1025:1561, ack 1, win 32768, options [TS val 3016 ecr 2059,eol], length 536: HTTP
3.016433 IP 10.1.2.4.49153 > 10.1.3.4.8080: Flags [.], seq 1561:2049, ack 1, win 32768, options [TS val 3016 ecr 2059,eol], length 488: HTTP
3.024575 IP 10.1.2.4.49153 > 10.1.3.4.8080: Flags [.], seq 2049:2585, ack 1, win 32768, options [TS val 3024 ecr 2059,eol], length 536: HTTP
3.024625 IP 10.1.2.4.49153 > 10.1.3.4.8080: Flags [.], seq 2585:3073, ack 1, win 32768, options [TS val 3024 ecr 2059,eol], length 488: HTTP
3.032767 IP 10.1.2.4.49153 > 10.1.3.4.8080: Flags [.], seq 3073:3609, ack 1, win 32768, options [TS val 3032 ecr 2059,eol], length 536: HTTP
3.032817 IP 10.1.2.4.49153 > 10.1.3.4.8080: Flags [.], seq 3609:4097, ack 1, win 32768, options [TS val 3032 ecr 2059,eol], length 488: HTTP
3.040959 IP 10.1.2.4.49153 > 10.1.3.4.8080: Flags [.], seq 4097:4633, ack 1, win 32768, options [TS val 3040 ecr 2059,eol], length 536: HTTP
3.041009 IP 10.1.2.4.49153 > 10.1.3.4.8080: Flags [.], seq 4633:5121, ack 1, win 32768, options [TS val 3040 ecr 2059,eol], length 488: HTTP
3.109357 IP 10.1.3.4.8080 > 10.1.2.4.49153: Flags [.], ack 537, win 32768, options [TS val 3059 ecr 3008,eol], length 0
3.109357 IP 10.1.2.4.49153 > 10.1.3.4.8080: Flags [.], seq 5121:5657, ack 1, win 32768, options [TS val 3109 ecr 3059,eol], length 536: HTTP
3.109408 IP 10.1.2.4.49153 > 10.1.3.4.8080: Flags [.], seq 5657:6193, ack 1, win 32768, options [TS val 3109 ecr 3059,eol], length 536: HTTP
3.117549 IP 10.1.3.4.8080 > 10.1.2.4.49153: Flags [.], ack 1561, win 32768, options [TS val 3067 ecr 3008,eol], length 0
3.117549 IP 10.1.2.4.49153 > 10.1.3.4.8080: Flags [.], seq 6193:6729, ack 1, win 32768, options [TS val 3117 ecr 3067,eol], length 536: HTTP
3.117600 IP 10.1.2.4.49153 > 10.1.3.4.8080: Flags [.], seq 6729:7265, ack 1, win 32768, options [TS val 3117 ecr 3067,eol], length 536: HTTP
3.117658 IP 10.1.2.4.49153 > 10.1.3.4.8080: Flags [.], seq 7265:7801, ack 1, win 32768, options [TS val 3117 ecr 3067,eol], length 536: HTTP
3.125741 IP 10.1.3.4.8080 > 10.1.2.4.49153: Flags [.], ack 2585, win 32768, options [TS val 3075 ecr 3016,eol], length 0
3.125741 IP 10.1.2.4.49153 > 10.1.3.4.8080: Flags [.], seq 7801:8337, ack 1, win 32768, options [TS val 3125 ecr 3075,eol], length 536: HTTP
3.125792 IP 10.1.2.4.49153 > 10.1.3.4.8080: Flags [.], seq 8337:8873, ack 1, win 32768, options [TS val 3125 ecr 3075,eol], length 536: HTTP
3.125849 IP 10.1.2.4.49153 > 10.1.3.4.8080: Flags [.], seq 8873:9409, ack 1, win 32768, options [TS val 3125 ecr 3075,eol], length 536: HTTP
3.133933 IP 10.1.3.4.8080 > 10.1.2.4.49153: Flags [.], ack 3609, win 32768, options [TS val 3083 ecr 3024,eol], length 0
3.133933 IP 10.1.2.4.49153 > 10.1.3.4.8080: Flags [.], seq 9409:9945, ack 1, win 32768, options [TS val 3133 ecr 3083,eol], length 536: HTTP
3.133984 IP 10.1.2.4.49153 > 10.1.3.4.8080: Flags [.], seq 9945:10481, ack 1, win 32768, options [TS val 3133 ecr 3083,eol], length 536: HTTP
3.134041 IP 10.1.2.4.49153 > 10.1.3.4.8080: Flags [.], seq 10481:11017, ack 1, win 32768, options [TS val 3133 ecr 3083,eol], length 536: HTTP
3.142125 IP 10.1.3.4.8080 > 10.1.2.4.49153: Flags [.], ack 4633, win 32768, options [TS val 3092 ecr 3032,eol], length 0
3.142125 IP 10.1.2.4.49153 > 10.1.3.4.8080: Flags [.], seq 11017:11553, ack 1, win 32768, options [TS val 3142 ecr 3092,eol], length 536: HTTP
3.142176 IP 10.1.2.4.49153 > 10.1.3.4.8080: Flags [.], seq 11553:12089, ack 1, win 32768, options [TS val 3142 ecr 3092,eol], length 536: HTTP
3.142231 IP 10.1.2.4.49153 > 10.1.3.4.8080: Flags [.], seq 12089:12625, ack 1, win 32768, options [TS val 3142 ecr 3092,eol], length 536: HTTP
3.210524 IP 10.1.3.4.8080 > 10.1.2.4.49153: Flags [.], ack 5657, win 32768, options [TS val 3160 ecr 3040,eol], length 0
3.210524 IP 10.1.2.4.49153 > 10.1.3.4.8080: Flags [.], seq 12625:13161, ack 1, win 32768, options [TS val 3210 ecr 3160,eol], length 536: HTTP
3.210575 IP 10.1.2.4.49153 > 10.1.3.4.8080: Flags [.], seq 13161:13697, ack 1, win 32768, options [TS val 3210 ecr 3160,eol], length 536: HTTP
3.210632 IP 10.1.2.4.49153 > 10.1.3.4.8080: Flags [.], seq 13697:14233, ack 1, win 32768, options [TS val 3210 ecr 3160,eol], length 536: HTTP
3.218716 IP 10.1.3.4.8080 > 10.1.2.4.49153: Flags [.], ack 6729, win 32768, options [TS val 3168 ecr 3109,eol], length 0
3.218716 IP 10.1.2.4.49153 > 10.1.3.4.8080: Flags [.], seq 14233:14769, ack 1, win 32768, options [TS val 3218 ecr 3168,eol], length 536: HTTP
3.218767 IP 10.1.2.4.49153 > 10.1.3.4.8080: Flags [.], seq 14769:15305, ack 1, win 32768, options [TS val 3218 ecr 3168,eol], length 536: HTTP
3.218823 IP 10.1.2.4.49153 > 10.1.3.4.8080: Flags [.], seq 15305:15841, ack 1, win 32768, options [TS val 3218 ecr 3168,eol], length 536: HTTP
3.220604 IP 10.1.3.4.8080 > 10.1.2.4.49153: Flags [.], ack 7801, win 32768, options [TS val 3170 ecr 3117,eol], length 0
3.220604 IP 10.1.2.4.49153 > 10.1.3.4.8080: Flags [.], seq 15841:16377, ack 1, win 32768, options [TS val 3220 ecr 3170,eol], length 536: HTTP
3.220655 IP 10.1.2.4.49153 > 10.1.3.4.8080: Flags [.], seq 16377:16913, ack 1, win 32768, options [TS val 3220 ecr 3170,eol], length 536: HTTP
3.220713 IP 10.1.2.4.49153 > 10.1.3.4.8080: Flags [.], seq 16913:17449, ack 1, win 32768, options [TS val 3220 ecr 3170,eol], length 536: HTTP
3.227852 IP 10.1.3.4.8080 > 10.1.2.4.49153: Flags [.], ack 8873, win 32768, options [TS val 3177 ecr 3125,eol], length 0
3.227852 IP 10.1.2.4.49153 > 10.1.3.4.8080: Flags [.], seq 17449:17985, ack 1, win 32768, options [TS val 3227 ecr 3177,eol], length 536: HTTP
3.227903 IP 10.1.2.4.49153 > 10.1.3.4.8080: Flags [.], seq 17985:18521, ack 1, win 32768, options [TS val 3227 ecr 3177,eol], length 536: HTTP
3.227958 IP 10.1.2.4.49153 > 10.1.3.4.8080: Flags [.], seq 18521:19057, ack 1, win 32768, options [TS val 3227 ecr 3177,eol], length 536: HTTP
3.235100 IP 10.1.3.4.8080 > 10.1.2.4.49153: Flags [.], ack 9945, win 32768, options [TS val 3184 ecr 3125,eol], length 0
3.235100 IP 10.1.2.4.49153 > 10.1.3.4.8080: Flags [.], seq 19057:19593, ack 1, win 32768, options [TS val 3235 ecr 3184,eol], length 536: HTTP
3.235151 IP 10.1.2.4.49153 > 10.1.3.4.8080: Flags [.], seq 19593:20129, ack 1, win 32768, options [TS val 3235 ecr 3184,eol], length 536: HTTP
3.235208 IP 10.1.2.4.49153 > 10.1.3.4.8080: Flags [.], seq 20129:20665, ack 1, win 32768, options [TS val 3235 ecr 3184,eol], length 536: HTTP
3.236988 IP 10.1.3.4.8080 > 10.1.2.4.49153: Flags [.], ack 11017, win 32768, options [TS val 3186 ecr 3133,eol], length 0
3.236988 IP 10.1.2.4.49153 > 10.1.3.4.8080: Flags [.], seq 20665:21201, ack 1, win 32768, options [TS val 3236 ecr 3186,eol], length 536: HTTP
3.237039 IP 10.1.2.4.49153 > 10.1.3.4.8080: Flags [.], seq 21201:21737, ack 1, win 32768, options [TS val 3236 ecr 3186,eol], length 536: HTTP
3.237096 IP 10.1.2.4.49153 > 10.1.3.4.8080: Flags [.], seq 21737:22273, ack 1, win 32768, options [TS val 3236 ecr 3186,eol], length 536: HTTP
3.244236 IP 10.1.3.4.8080 > 10.1.2.4.49153: Flags [.], ack 12089, win 32768, options [TS val 3194 ecr 3142,eol], length 0
3.244236 IP 10.1.2.4.49153 > 10.1.3.4.8080: Flags [.], seq 22273:22809, ack 1, win 32768, options [TS val 3244 ecr 3194,eol], length 536: HTTP
3.244287 IP 10.1.2.4.49153 > 10.1.3.4.8080: Flags [.], seq 22809:23345, ack 1, win 32768, options [TS val 3244 ecr 3194,eol], length 536: HTTP
3.244343 IP 10.1.2.4.49153 > 10.1.3.4.8080: Flags [.], seq 23345:23881, ack 1, win 32768, options [TS val 3244 ecr 3194,eol], length 536: HTTP
3.311691 IP 10.1.3.4.8080 > 10.1.2.4.49153: Flags [.], ack 13161, win 32768, options [TS val 3261 ecr 3142,eol], length 0
3.311691 IP 10.1.2.4.49153 > 10.1.3.4.8080: Flags [.], seq 23881:24417, ack 1, win 32768, options [TS val 3311 ecr 3261,eol], length 536: HTTP
3.311741 IP 10.1.2.4.49153 > 10.1.3.4.8080: Flags [.], seq 24417:24953, ack 1, win 32768, options [TS val 3311 ecr 3261,eol], length 536: HTTP
3.311799 IP 10.1.2.4.49153 > 10.1.3.4.8080: Flags [.], seq 24953:25489, ack 1, win 32768, options [TS val 3311 ecr 3261,eol], length 536: HTTP
3.313579 IP 10.1.3.4.8080 > 10.1.2.4.49153: Flags [.], ack 14233, win 32768, options [TS val 3263 ecr 3210,eol], length 0
3.313579 IP 10.1.2.4.49153 > 10.1.3.4.8080: Flags [.], seq 25489:26025, ack 1, win 32768, options [TS val 3313 ecr 3263,eol], length 536: HTTP
3.313629 IP 10.1.2.4.49153 > 10.1.3.4.8080: Flags [.], seq 26025:26561, ack 1, win 32768, options [TS val 3313 ecr 3263,eol], length 536: HTTP
3.313691 IP 10.1.2.4.49153 > 10.1.3.4.8080: Flags [.], seq 26561:27097, ack 1, win 32768, options [TS val 3313 ecr 3263,eol], length 536: HTTP
3.320841 IP 10.1.3.4.8080 > 10.1.2.4.49153: Flags [.], ack 14233, win 32768, options [TS val 3270 ecr 3210,sack 1 {14769:15305}], length 0
3.320841 IP 10.1.2.4.49153 > 10.1.3.4.8080: Flags [.], seq 27097:27633, ack 1, win 32768, options [TS val 3320 ecr 3270,eol], length 536: HTTP
3.321785 IP 10.1.3.4.8080 > 10.1.2.4.49153: Flags [.], ack 14233, win 32768, options [TS val 3271 ecr 3210,sack 1 {14769:15841}], length 0
3.321785 IP 10.1.2.4.49153 > 10.1.3.4.8080: Flags [.], seq 27633:28169, ack 1, win 32768, options [TS val 3321 ecr 3271,eol], length 536: HTTP
3.322729 IP 10.1.3.4.8080 > 10.1.2.4.49153: Flags [.], ack 14233, win 32768, options [TS val 3272 ecr 3210,sack 1 {14769:16377}], length 0
3.322729 IP 10.1.2.4.49153 > 10.1.3.4.8080: Flags [.], seq 14233:14769, ack 1, win 32768, options [TS val 3322 ecr 3272,eol], length 536: HTTP
3.323673 IP 10.1.3.4.8080 > 10.1.2.4.49153: Flags [.], ack 14233, win 32768, options [TS val 3273 ecr 3210,sack 1 {14769:16913}], length 0
3.324617 IP 10.1.3.4.8080 > 10.1.2.4.49153: Flags [.], ack 14233, win 32768, options [TS val 3274 ecr 3210,sack 1 {14769:17449}], length 0
3.329991 IP 10.1.3.4.8080 > 10.1.2.4.49153: Flags [.], ack 14233, win 32768, options [TS val 3279 ecr 3210,sack 2 {17985:18521}{14769:17449}], length 0
3.330935 IP 10.1.3.4.8080 > 10.1.2.4.49153: Flags [.], ack 14233, win 32768, options [TS val 3280 ecr 3210,sack 2 {17985:19057}{14769:17449}], length 0
3.330935 IP 10.1.2.4.49153 > 10.1.3.4.8080: Flags [.], seq 28169:28705, ack 1, win 32768, options [TS val 3330 ecr 3280,eol], length 536: HTTP
3.336295 IP 10.1.3.4.8080 > 10.1.2.4.49153: Flags [.], ack 14233, win 32768, options [TS val 3286 ecr 3210,sack 2 {17985:19593}{14769:17449}], length 0
3.337239 IP 10.1.3.4.8080 > 10.1.2.4.49153: Flags [.], ack 14233, win 32768, options [TS val 3287 ecr 3210,sack 2 {17985:20129}{14769:17449}], length 0
3.338183 IP 10.1.3.4.8080 > 10.1.2.4.49153: Flags [.], ack 14233, win 32768, options [TS val 3288 ecr 3210,sack 2 {17985:20665}{14769:17449}], length 0
3.338183 IP 10.1.2.4.49153 > 10.1.3.4.8080: Flags [.], seq 17449:17985, ack 1, win 32768, options [TS val 3338 ecr 3288,eol], length 536: HTTP
3.339127 IP 10.1.3.4.8080 > 10.1.2.4.49153: Flags [.], ack 14233, win 32768, options [TS val 3288 ecr 3210,sack 2 {17985:21201}{14769:17449}], length 0
3.340071 IP 10.1.3.4.8080 > 10.1.2.4.49153: Flags [.], ack 14233, win 32768, options [TS val 3289 ecr 3210,sack 2 {17985:21737}{14769:17449}], length 0
3.340071 IP 10.1.2.4.49153 > 10.1.3.4.8080: Flags [.], seq 28705:29241, ack 1, win 32768, options [TS val 3340 ecr 3289,eol], length 536: HTTP
3.341015 IP 10.1.3.4.8080 > 10.1.2.4.49153: Flags [.], ack 14233, win 32768, options [TS val 3290 ecr 3210,sack 2 {17985:22273}{14769:17449}], length 0
3.345431 IP 10.1.3.4.8080 > 10.1.2.4.49153: Flags [.], ack 14233, win 32768, options [TS val 3295 ecr 3210,sack 2 {17985:22809}{14769:17449}], length 0
3.345431 IP 10.1.2.4.49153 > 10.1.3.4.8080: Flags [.], seq 29241:29777, ack 1, win 32768, options [TS val 3345 ecr 3295,eol], length 536: HTTP
3.346375 IP 10.1.3.4.8080 > 10.1.2.4.49153: Flags [.], ack 14233, win 32768, options [TS val 3296 ecr 3210,sack 2 {17985:23345}{14769:17449}], length 0
3.347319 IP 10.1.3.4.8080 > 10.1.2.4.49153: Flags [.], ack 14233, win 32768, options [TS val 3297 ecr 3210,sack 2 {17985:23881}{14769:17449}], length 0
3.413844 IP 10.1.3.4.8080 > 10.1.2.4.49153: Flags [.], ack 14233, win 32768, options [TS val 3363 ecr 3210,sack 3 {24417:24953}{17985:23881}{14769:17449}], length 0
3.413844 IP 10.1.2.4.49153 > 10.1.3.4.8080: Flags [.], seq 29777:30313, ack 1, win 32768, options [TS val 3413 ecr 3363,eol], length 536: HTTP
3.414788 IP 10.1.3.4.8080 > 10.1.2.4.49153: Flags [.], ack 14233, win 32768, options [TS val 3364 ecr 3210,sack 3 {24417:25489}{17985:23881}{14769:17449}], length 0
3.416676 IP 10.1.3.4.8080 > 10.1.2.4.49153: Flags [.], ack 14233, win 32768, options [TS val 3366 ecr 3210,sack 3 {26025:26561}{24417:25489}{17985:23881}], length 0
3.416676 IP 10.1.2.4.49153 > 10.1.3.4.8080: Flags [.], seq 23881:24417, ack 1, win 32768, options [TS val 3416 ecr 3366,eol], length 536: HTTP
3.417620 IP 10.1.3.4.8080 > 10.1.2.4.49153: Flags [.], ack 14233, win 32768, options [TS val 3367 ecr 3210,sack 3 {26025:27097}{24417:25489}{17985:23881}], length 0
3.417620 IP 10.1.2.4.49153 > 10.1.3.4.8080: Flags [.], seq 30313:30849, ack 1, win 32768, options [TS val 3417 ecr 3367,eol], length 536: HTTP
3.422994 IP 10.1.3.4.8080 > 10.1.2.4.49153: Flags [.], ack 14233, win 32768, options [TS val 3372 ecr 3210,sack 3 {27633:28169}{26025:27097}{24417:25489}], length 0
3.422994 IP 10.1.2.4.49153 > 10.1.3.4.8080: Flags [.], seq 25489:26025, ack 1, win 32768, options [TS val 3422 ecr 3372,eol], length 536: HTTP
3.423938 IP 10.1.3.4.8080 > 10.1.2.4.49153: Flags [.], ack 17449, win 32768, options [TS val 3373 ecr 3322,sack 3 {27633:28169}{26025:27097}{24417:25489}], length 0
3.423938 IP 10.1.2.4.49153 > 10.1.3.4.8080: Flags [.], seq 30849:31385, ack 1, win 32768, options [TS val 3423 ecr 3373,eol], length 536: HTTP
3.423988 IP 10.1.2.4.49153 > 10.1.3.4.8080: Flags [.], seq 31385:31921, ack 1, win 32768, options [TS val 3423 ecr 3373,eol], length 536: HTTP
3.432144 IP 10.1.3.4.8080 > 10.1.2.4.49153: Flags [.], ack 17449, win 32768, options [TS val 3381 ecr 3322,sack 3 {27633:28705}{26025:27097}{24417:25489}], length 0
3.432144 IP 10.1.2.4.49153 > 10.1.3.4.8080: Flags [.], seq 31921:32457, ack 1, win 32768, options [TS val 3432 ecr 3381,eol], length 536: HTTP
3.439392 IP 10.1.3.4.8080 > 10.1.2.4.49153: Flags [.], ack 23881, win 32768, options [TS val 3389 ecr 3338,sack 3 {27633:28705}{26025:27097}{24417:25489}], length 0
3.439392 IP 10.1.2.4.49153 > 10.1.3.4.8080: Flags [.], seq 32457:32993, ack 1, win 32768, options [TS val 3439 ecr 3389,eol], length 536: HTTP
3.446640 IP 10.1.3.4.8080 > 10.1.2.4.49153: Flags [.], ack 23881, win 32768, options [TS val 3396 ecr 3338,sack 3 {29241:29777}{27633:28705}{26025:27097}], length 0
3.446640 IP 10.1.2.4.49153 > 10.1.3.4.8080: Flags [.], seq 27097:27633, ack 1, win 32768, options [TS val 3446 ecr 3396,eol], length 536: HTTP
3.515053 IP 10.1.3.4.8080 > 10.1.2.4.49153: Flags [.], ack 23881, win 32768, options [TS val 3464 ecr 3338,sack 3 {29241:30313}{27633:28705}{26025:27097}], length 0
3.515053 IP 10.1.2.4.49153 > 10.1.3.4.8080: Flags [.], seq 32993:33529, ack 1, win 32768, options [TS val 3515 ecr 3464,eol], length 536: HTTP
3.517885 IP 10.1.3.4.8080 > 10.1.2.4.49153: Flags [.], ack 25489, win 32768, options [TS val 3467 ecr 3416,sack 3 {29241:30313}{27633:28705}{26025:27097}], length 0
3.517885 IP 10.1.2.4.49153 > 10.1.3.4.8080: Flags [.], seq 33529:34065, ack 1, win 32768, options [TS val 3517 ecr 3467,eol], length 536: HTTP
3.517935 IP 10.1.2.4.49153 > 10.1.3.4.8080: Flags [.], seq 34065:34601, ack 1, win 32768, options [TS val 3517 ecr 3467,eol], length 536: HTTP
3.524189 IP 10.1.3.4.8080 > 10.1.2.4.49153: Flags [.], ack 27097, win 32768, options [TS val 3474 ecr 3422,sack 2 {29241:30313}{27633:28705}], length 0
3.524189 IP 10.1.2.4.49153 > 10.1.3.4.8080: Flags [.], seq 34601:35137, ack 1, win 32768, options [TS val 3524 ecr 3474,eol], length 536: HTTP
3.525147 IP 10.1.3.4.8080 > 10.1.2.4.49153: Flags [.], ack 27097, win 32768, options [TS val 3474 ecr 3422,sack 3 {30849:31385}{29241:30313}{27633:28705}], length 0
3.525147 IP 10.1.2.4.49153 > 10.1.3.4.8080: Flags [.], seq 28705:29241, ack 1, win 32768, options [TS val 3525 ecr 3474,eol], length 536: HTTP
3.526091 IP 10.1.3.4.8080 > 10.1.2.4.49153: Flags [.], ack 27097, win 32768, options [TS val 3475 ecr 3422,sack 3 {30849:31921}{29241:30313}{27633:28705}], length 0
3.526091 IP 10.1.2.4.49153 > 10.1.3.4.8080: Flags [.], seq 35137:35673, ack 1, win 32768, options [TS val 3526 ecr 3475,eol], length 536: HTTP
3.533353 IP 10.1.3.4.8080 > 10.1.2.4.49153: Flags [.], ack 27097, win 32768, options [TS val 3483 ecr 3422,sack 3 {30849:32457}{29241:30313}{27633:28705}], length 0
3.533353 IP 10.1.2.4.49153 > 10.1.3.4.8080: Flags [.], seq 30313:30849, ack 1, win 32768, options [TS val 3533 ecr 3483,eol], length 536: HTTP
3.540601 IP 10.1.3.4.8080 > 10.1.2.4.49153: Flags [.], ack 27097, win 32768, options [TS val 3490 ecr 3422,sack 3 {30849:32993}{29241:30313}{27633:28705}], length 0
3.540601 IP 10.1.2.4.49153 > 10.1.3.4.8080: Flags [.], seq 35673:36209, ack 1, win 32768, options [TS val 3540 ecr 3490,eol], length 536: HTTP
3.547835 IP 10.1.3.4.8080 > 10.1.2.4.49153: Flags [.], ack 28705, win 32768, options [TS val 3497 ecr 3446,sack 2 {30849:32993}{29241:30313}], length 0
3.547835 IP 10.1.2.4.49153 > 10.1.3.4.8080: Flags [.], seq 36209:36745, ack 1, win 32768, options [TS val 3547 ecr 3497,eol], length 536: HTTP
3.547885 IP 10.1.2.4.49153 > 10.1.3.4.8080: Flags [.], seq 36745:37281, ack 1, win 32768, options [TS val 3547 ecr 3497,eol], length 536: HTTP
3.547944 IP 10.1.2.4.49153 > 10.1.3.4.8080: Flags [.], seq 37281:37817, ack 1, win 32768, options [TS val 3547 ecr 3497,eol], length 536: HTTP
3.619094 IP 10.1.3.4.8080 > 10.1.2.4.49153: Flags [.], ack 28705, win 32768, options [TS val 3568 ecr 3446,sack 3 {33529:34065}{30849:32993}{29241:30313}], length 0
3.619094 IP 10.1.2.4.49153 > 10.1.3.4.8080: Flags [.], seq 37817:38353, ack 1, win 32768, options [TS val 3619 ecr 3568,eol], length 536: HTTP
3.620038 IP 10.1.3.4.8080 > 10.1.2.4.49153: Flags [.], ack 28705, win 32768, options [TS val 3569 ecr 3446,sack 3 {33529:34601}{30849:32993}{29241:30313}], length 0
3.620038 IP 10.1.2.4.49153 > 10.1.3.4.8080: Flags [.], seq 38353:38889, ack 1, win 32768, options [TS val 3620 ecr 3569,eol], length 536: HTTP
3.625398 IP 10.1.3.4.8080 > 10.1.2.4.49153: Flags [.], ack 28705, win 32768, options [TS val 3575 ecr 3446,sack 3 {33529:35137}{30849:32993}{29241:30313}], length 0
3.625398 IP 10.1.2.4.49153 > 10.1.3.4.8080: Flags [.], seq 32993:33529, ack 1, win 32768, options [TS val 3625 ecr 3575,eol], length 536: HTTP
3.626342 IP 10.1.3.4.8080 > 10.1.2.4.49153: Flags [.], ack 30313, win 32768, options [TS val 3576 ecr 3525,sack 2 {33529:35137}{30849:32993}], length 0
3.627286 IP 10.1.3.4.8080 > 10.1.2.4.49153: Flags [.], ack 30313, win 32768, options [TS val 3577 ecr 3525,sack 2 {33529:35673}{30849:32993}], length 0
3.634534 IP 10.1.3.4.8080 > 10.1.2.4.49153: Flags [.], ack 32993, win 32768, options [TS val 3584 ecr 3533,sack 1 {33529:35673}], length 0
3.641782 IP 10.1.3.4.8080 > 10.1.2.4.49153: Flags [.], ack 32993, win 32768, options [TS val 3591 ecr 3533,sack 1 {33529:36209}], length 0
3.649016 IP 10.1.3.4.8080 > 10.1.2.4.49153: Flags [.], ack 32993, win 32768, options [TS val 3598 ecr 3533,sack 1 {33529:36745}], length 0
3.649960 IP 10.1.3.4.8080 > 10.1.2.4.49153: Flags [.], ack 32993, win 32768, options [TS val 3599 ecr 3533,sack 1 {33529:37281}], length 0
3.650904 IP 10.1.3.4.8080 > 10.1.2.4.49153: Flags [.], ack 32993, win 32768, options [TS val 3600 ecr 3533,sack 1 {33529:37817}], length 0
3.650904 IP 10.1.2.4.49153 > 10.1.3.4.8080: Flags [.], seq 38889:39425, ack 1, win 32768, options [TS val 3650 ecr 3600,eol], length 536: HTTP
3.720275 IP 10.1.3.4.8080 > 10.1.2.4.49153: Flags [.], ack 32993, win 32768, options [TS val 3670 ecr 3533,sack 1 {33529:38353}], length 0
3.720275 IP 10.1.2.4.49153 > 10.1.3.4.8080: Flags [.], seq 39425:39961, ack 1, win 32768, options [TS val 3720 ecr 3670,eol], length 536: HTTP
3.721219 IP 10.1.3.4.8080 > 10.1.2.4.49153: Flags [.], ack 32993, win 32768, options [TS val 3671 ecr 3533,sack 1 {33529:38889}], length 0
3.721219 IP 10.1.2.4.49153 > 10.1.3.4.8080: Flags [.], seq 39961:40497, ack 1, win 32768, options [TS val 3721 ecr 3671,eol], length 536: HTTP
3.726565 IP 10.1.3.4.8080 > 10.1.2.4.49153: Flags [.], ack 38889, win 32768, options [TS val 3676 ecr 3625,eol], length 0
3.726565 IP 10.1.2.4.49153 > 10.1.3.4.8080: Flags [.], seq 40497:41033, ack 1, win 32768, options [TS val 3726 ecr 3676,eol], length 536: HTTP
3.821442 IP 10.1.3.4.8080 > 10.1.2.4.49153: Flags [.], ack 39961, win 32768, options [TS val 3771 ecr 3650,eol], length 0
3.821442 IP 10.1.2.4.49153 > 10.1.3.4.8080: Flags [.], seq 41033:41569, ack 1, win 32768, options [TS val 3821 ecr 3771,eol], length 536: HTTP
3.821492 IP 10.1.2.4.49153 > 10.1.3.4.8080: Flags [.], seq 41569:42105, ack 1, win 32768, options [TS val 3821 ecr 3771,eol], length 536: HTTP
3.827732 IP 10.1.3.4.8080 > 10.1.2.4.49153: Flags [.], ack 41033, win 32768, options [TS val 3777 ecr 3721,eol], length 0
3.827732 IP 10.1.2.4.49153 > 10.1.3.4.8080: Flags [.], seq 42105:42641, ack 1, win 32768, options [TS val 3827 ecr 3777,eol], length 536: HTTP
3.827782 IP 10.1.2.4.49153 > 10.1.3.4.8080: Flags [.], seq 42641:43177, ack 1, win 32768, options [TS val 3827 ecr 3777,eol], length 536: HTTP
3.827838 IP 10.1.2.4.49153 > 10.1.3.4.8080: Flags [.], seq 43177:43713, ack 1, win 32768, options [TS val 3827 ecr 3777,eol], length 536: HTTP
3.923553 IP 10.1.3.4.8080 > 10.1.2.4.49153: Flags [.], ack 42105, win 32768, options [TS val 3873 ecr 3821,eol], length 0
3.923553 IP 10.1.2.4.49153 > 10.1.3.4.8080: Flags [.], seq 43713:44249, ack 1, win 32768, options [TS val 3923 ecr 3873,eol], length 536: HTTP
3.923603 IP 10.1.2.4.49153 > 10.1.3.4.8080: Flags [.], seq 44249:44785, ack 1, win 32768, options [TS val 3923 ecr 3873,eol], length 536: HTTP
3.929856 IP 10.1.3.4.8080 > 10.1.2.4.49153: Flags [.], ack 42105, win 32768, options [TS val 3879 ecr 3821,sack 1 {42641:43177}], length 0
3.929856 IP 10.1.2.4.49153 > 10.1.3.4.8080: Flags [.], seq 44785:45321, ack 1, win 32768, options [TS val 3929 ecr 3879,eol], length 536: HTTP
3.930800 IP 10.1.3.4.8080 > 10.1.2.4.49153: Flags [.], ack 42105, win 32768, options [TS val 3880 ecr 3821,sack 1 {42641:43713}], length 0
3.930800 IP 10.1.2.4.49153 > 10.1.3.4.8080: Flags [.], seq 45321:45857, ack 1, win 32768, options [TS val 3930 ecr 3880,eol], length 536: HTTP
4.024733 IP 10.1.3.4.8080 > 10.1.2.4.49153: Flags [.], ack 42105, win 32768, options [TS val 3974 ecr 3821,sack 1 {42641:44249}], length 0
4.024733 IP 10.1.2.4.49153 > 10.1.3.4.8080: Flags [.], seq 42105:42641, ack 1, win 32768, options [TS val 4024 ecr 3974,eol], length 536: HTTP
4.025677 IP 10.1.3.4.8080 > 10.1.2.4.49153: Flags [.], ack 42105, win 32768, options [TS val 3975 ecr 3821,sack 1 {42641:44785}], length 0
4.031037 IP 10.1.3.4.8080 > 10.1.2.4.49153: Flags [.], ack 42105, win 32768, options [TS val 3980 ecr 3821,sack 1 {42641:45321}], length 0
4.031981 IP 10.1.3.4.8080 > 10.1.2.4.49153: Flags [.], ack 42105, win 32768, options [TS val 3981 ecr 3821,sack 1 {42641:45857}], length 0
4.031981 IP 10.1.2.4.49153 > 10.1.3.4.8080: Flags [.], seq 45857:46393, ack 1, win 32768, options [TS val 4031 ecr 3981,eol], length 536: HTTP
4.125900 IP 10.1.3.4.8080 > 10.1.2.4.49153: Flags [.], ack 45857, win 32768, options [TS val 4075 ecr 4024,eol], length 0
4.125900 IP 10.1.2.4.49153 > 10.1.3.4.8080: Flags [.], seq 46393:46929, ack 1, win 32768, options [TS val 4125 ecr 4075,eol], length 536: HTTP
4.227067 IP 10.1.3.4.8080 > 10.1.2.4.49153: Flags [.], ack 46929, win 32768, options [TS val 4176 ecr 4031,eol], length 0
4.227067 IP 10.1.2.4.49153 > 10.1.3.4.8080: Flags [.], seq 46929:47465, ack 1, win 32768, options [TS val 4227 ecr 4176,eol], length 536: HTTP
4.227117 IP 10.1.2.4.49153 > 10.1.3.4.8080: Flags [.], seq 47465:48001, ack 1, win 32768, options [TS val 4227 ecr 4176,eol], length 536: HTTP
4.329178 IP 10.1.3.4.8080 > 10.1.2.4.49153: Flags [.], ack 48001, win 32768, options [TS val 4279 ecr 4227,eol], length 0
4.329178 IP 10.1.2.4.49153 > 10.1.3.4.8080: Flags [.], seq 48001:48537, ack 1, win 32768, options [TS val 4329 ecr 4279,eol], length 536: HTTP
4.329228 IP 10.1.2.4.49153 > 10.1.3.4.8080: Flags [.], seq 48537:49073, ack 1, win 32768, options [TS val 4329 ecr 4279,eol], length 536: HTTP
4.329287 IP 10.1.2.4.49153 > 10.1.3.4.8080: Flags [.], seq 49073:49609, ack 1, win 32768, options [TS val 4329 ecr 4279,eol], length 536: HTTP
4.431289 IP 10.1.3.4.8080 > 10.1.2.4.49153: Flags [.], ack 49073, win 32768, options [TS val 4381 ecr 4329,eol], length 0
4.431289 IP 10.1.2.4.49153 > 10.1.3.4.8080: Flags [.], seq 49609:50145, ack 1, win 32768, options [TS val 4431 ecr 4381,eol], length 536: HTTP
4.431339 IP 10.1.2.4.49153 > 10.1.3.4.8080: Flags [.], seq 50145:50681, ack 1, win 32768, options [TS val 4431 ecr 4381,eol], length 536: HTTP
4.532455 IP 10.1.3.4.8080 > 10.1.2.4.49153: Flags [.], ack 50145, win 32768, options [TS val 4482 ecr 4329,eol], length 0
4.532455 IP 10.1.2.4.49153 > 10.1.3.4.8080: Flags [.], seq 50681:51217, ack 1, win 32768, options [TS val 4532 ecr 4482,eol], length 536: HTTP
4.532506 IP 10.1.2.4.49153 > 10.1.3.4.8080: Flags [.], seq 51217:51753, ack 1, win 32768, options [TS val 4532 ecr 4482,eol], length 536: HTTP
4.633622 IP 10.1.3.4.8080 > 10.1.2.4.49153: Flags [.], ack 51217, win 32768, options [TS val 4583 ecr 4431,eol], length 0
4.633622 IP 10.1.2.4.49153 > 10.1.3.4.8080: Flags [.], seq 51753:52289, ack 1, win 32768, options [TS val 4633 ecr 4583,eol], length 536: HTTP
4.633673 IP 10.1.2.4.49153 > 10.1.3.4.8080: Flags [.], seq 52289:52825, ack 1, win 32768, options [TS val 4633 ecr 4583,eol], length 536: HTTP
4.633729 IP 10.1.2.4.49153 > 10.1.3.4.8080: Flags [.], seq 52825:53361, ack 1, win 32768, options [TS val 4633 ecr 4583,eol], length 536: HTTP
4.734803 IP 10.1.3.4.8080 > 10.1.2.4.49153: Flags [.], ack 51217, win 32768, options [TS val 4684 ecr 4431,sack 1 {51753:52289}], length 0
4.734803 IP 10.1.2.4.49153 > 10.1.3.4.8080: Flags [.], seq 53361:53897, ack 1, win 32768, options [TS val 4734 ecr 4684,eol], length 536: HTTP
4.735747 IP 10.1.3.4.8080 > 10.1.2.4.49153: Flags [.], ack 51217, win 32768, options [TS val 4685 ecr 4431,sack 1 {51753:52825}], length 0
4.735747 IP 10.1.2.4.49153 > 10.1.3.4.8080: Flags [.], seq 53897:54433, ack 1, win 32768, options [TS val 4735 ecr 4685,eol], length 536: HTTP
4.736691 IP 10.1.3.4.8080 > 10.1.2.4.49153: Flags [.], ack 51217, win 32768, options [TS val 4686 ecr 4431,sack 1 {51753:53361}], length 0
4.736691 IP 10.1.2.4.49153 > 10.1.3.4.8080: Flags [.], seq 51217:51753, ack 1, win 32768, options [TS val 4736 ecr 4686,eol], length 536: HTTP
4.836942 IP 10.1.3.4.8080 > 10.1.2.4.49153: Flags [.], ack 51217, win 32768, options [TS val 4786 ecr 4431,sack 2 {53897:54433}{51753:53361}], length 0
5.633622 IP 10.1.2.4.49153 > 10.1.3.4.8080: Flags [.], seq 51217:51753, ack 1, win 32768, options [TS val 5633 ecr 4786,eol], length 536: HTTP
5.734802 IP 10.1.3.4.8080 > 10.1.2.4.49153: Flags [.], ack 53361, win 32768, options [TS val 5684 ecr 5633,sack 1 {53897:54433}], length 0
5.734802 IP 10.1.2.4.49153 > 10.1.3.4.8080: Flags [.], seq 53361:53897, ack 1, win 32768, options [TS val 5734 ecr 5684,eol], length 536: HTTP
5.734853 IP 10.1.2.4.49153 > 10.1.3.4.8080: Flags [.], seq 54433:54969, ack 1, win 32768, options [TS val 5734 ecr 5684,eol], length 536: HTTP
5.835969 IP 10.1.3.4.8080 > 10.1.2.4.49153: Flags [.], ack 54433, win 32768, options [TS val 5785 ecr 5734,eol], length 0
5.835969 IP 10.1.2.4.49153 > 10.1.3.4.8080: Flags [.], seq 54969:55505, ack 1, win 32768, options [TS val 5835 ecr 5785,eol], length 536: HTTP
5.937150 IP 10.1.3.4.8080 > 10.1.2.4.49153: Flags [.], ack 54433, win 32768, options [TS val 5887 ecr 5734,sack 1 {54969:55505}], length 0
5.937150 IP 10.1.2.4.49153 > 10.1.3.4.8080: Flags [.], seq 55505:56041, ack 1, win 32768, options [TS val 5937 ecr 5887,eol], length 536: HTTP
6.038331 IP 10.1.3.4.8080 > 10.1.2.4.49153: Flags [.], ack 54433, win 32768, options [TS val 5988 ecr 5734,sack 1 {54969:56041}], length 0
6.038331 IP 10.1.2.4.49153 > 10.1.3.4.8080: Flags [.], seq 56041:56577, ack 1, win 32768, options [TS val 6038 ecr 5988,eol], length 536: HTTP
6.139512 IP 10.1.3.4.8080 > 10.1.2.4.49153: Flags [.], ack 54433, win 32768, options [TS val 6089 ecr 5734,sack 1 {54969:56577}], length 0
6.139512 IP 10.1.2.4.49153 > 10.1.3.4.8080: Flags [.], seq 54433:54969, ack 1, win 32768, options [TS val 6139 ecr 6089,eol], length 536: HTTP
6.240678 IP 10.1.3.4.8080 > 10.1.2.4.49153: Flags [.], ack 56577, win 32768, options [TS val 6190 ecr 6139,eol], length 0
6.240678 IP 10.1.2.4.49153 > 10.1.3.4.8080: Flags [.], seq 56577:57113, ack 1, win 32768, options [TS val 6240 ecr 6190,eol], length 536: HTTP
6.240729 IP 10.1.2.4.49153 > 10.1.3.4.8080: Flags [.], seq 57113:57649, ack 1, win 32768, options [TS val 6240 ecr 6190,eol], length 536: HTTP
6.342789 IP 10.1.3.4.8080 > 10.1.2.4.49153: Flags [.], ack 57649, win 32768, options [TS val 6292 ecr 6240,eol], length 0
6.342789 IP 10.1.2.4.49153 > 10.1.3.4.8080: Flags [.], seq 57649:58185, ack 1, win 32768, options [TS val 6342 ecr 6292,eol], length 536: HTTP
6.342840 IP 10.1.2.4.49153 > 10.1.3.4.8080: Flags [.], seq 58185:58721, ack 1, win 32768, options [TS val 6342 ecr 6292,eol], length 536: HTTP
6.444900 IP 10.1.3.4.8080 > 10.1.2.4.49153: Flags [.], ack 58721, win 32768, options [TS val 6394 ecr 6342,eol], length 0
6.444900 IP 10.1.2.4.49153 > 10.1.3.4.8080: Flags [.], seq 58721:59257, ack 1, win 32768, options [TS val 6444 ecr 6394,eol], length 536: HTTP
6.444950 IP 10.1.2.4.49153 > 10.1.3.4.8080: Flags [.], seq 59257:59793, ack 1, win 32768, options [TS val 6444 ecr 6394,eol], length 536: HTTP
6.445025 IP 10.1.2.4.49153 > 10.1.3.4.8080: Flags [.], seq 59793:60329, ack 1, win 32768, options [TS val 6444 ecr 6394,eol], length 536: HTTP
6.547011 IP 10.1.3.4.8080 > 10.1.2.4.49153: Flags [.], ack 59793, win 32768, options [TS val 6496 ecr 6444,eol], length 0
6.547011 IP 10.1.2.4.49153 > 10.1.3.4.8080: Flags [.], seq 60329:60865, ack 1, win 32768, options [TS val 6547 ecr 6496,eol], length 536: HTTP
6.547061 IP 10.1.2.4.49153 > 10.1.3.4.8080: Flags [.], seq 60865:61401, ack 1, win 32768, options [TS val 6547 ecr 6496,eol], length 536: HTTP
6.648178 IP 10.1.3.4.8080 > 10.1.2.4.49153: Flags [.], ack 60865, win 32768, options [TS val 6598 ecr 6444,eol], length 0
6.648178 IP 10.1.2.4.49153 > 10.1.3.4.8080: Flags [.], seq 61401:61937, ack 1, win 32768, options [TS val 6648 ecr 6598,eol], length 536: HTTP
6.648228 IP 10.1.2.4.49153 > 10.1.3.4.8080: Flags [.], seq 61937:62473, ack 1, win 32768, options [TS val 6648 ecr 6598,eol], length 536: HTTP
6.749344 IP 10.1.3.4.8080 > 10.1.2.4.49153: Flags [.], ack 61937, win 32768, options [TS val 6699 ecr 6547,eol], length 0
6.749344 IP 10.1.2.4.49153 > 10.1.3.4.8080: Flags [.], seq 62473:63009, ack 1, win 32768, options [TS val 6749 ecr 6699,eol], length 536: HTTP
6.749395 IP 10.1.2.4.49153 > 10.1.3.4.8080: Flags [.], seq 63009:63545, ack 1, win 32768, options [TS val 6749 ecr 6699,eol], length 536: HTTP
6.749450 IP 10.1.2.4.49153 > 10.1.3.4.8080: Flags [.], seq 63545:64081, ack 1, win 32768, options [TS val 6749 ecr 6699,eol], length 536: HTTP
6.850511 IP 10.1.3.4.8080 > 10.1.2.4.49153: Flags [.], ack 63009, win 32768, options [TS val 6800 ecr 6648,eol], length 0
6.850511 IP 10.1.2.4.49153 > 10.1.3.4.8080: Flags [.], seq 64081:64617, ack 1, win 32768, options [TS val 6850 ecr 6800,eol], length 536: HTTP
6.850562 IP 10.1.2.4.49153 > 10.1.3.4.8080: Flags [.], seq 64617:65153, ack 1, win 32768, options [TS val 6850 ecr 6800,eol], length 536: HTTP
6.951692 IP 10.1.3.4.8080 > 10.1.2.4.49153: Flags [.], ack 63009, win 32768, options [TS val 6901 ecr 6648,sack 1 {64081:64617}], length 0
6.951692 IP 10.1.2.4.49153 > 10.1.3.4.8080: Flags [.], seq 65153:65689, ack 1, win 32768, options [TS val 6951 ecr 6901,eol], length 536: HTTP
6.952636 IP 10.1.3.4.8080 > 10.1.2.4.49153: Flags [.], ack 63009, win 32768, options [TS val 6902 ecr 6648,sack 1 {64081:65153}], length 0
6.952636 IP 10.1.2.4.49153 > 10.1.3.4.8080: Flags [.], seq 65689:66225, ack 1, win 32768, options [TS val 6952 ecr 6902,eol], length 536: HTTP
7.052873 IP 10.1.3.4.8080 > 10.1.2.4.49153: Flags [.], ack 63009, win 32768, options [TS val 7002 ecr 6648,sack 1 {64081:65689}], length 0
7.052873 IP 10.1.2.4.49153 > 10.1.3.4.8080: Flags [.], seq 63009:63545, ack 1, win 32768, options [TS val 7052 ecr 7002,eol], length 536: HTTP
7.154054 IP 10.1.3.4.8080 > 10.1.2.4.49153: Flags [.], ack 63545, win 32768, options [TS val 7103 ecr 7052,sack 1 {64081:65689}], length 0
7.154054 IP 10.1.2.4.49153 > 10.1.3.4.8080: Flags [.], seq 63545:64081, ack 1, win 32768, options [TS val 7154 ecr 7103,eol], length 536: HTTP
7.255221 IP 10.1.3.4.8080 > 10.1.2.4.49153: Flags [.], ack 65689, win 32768, options [TS val 7205 ecr 7154,eol], length 0
7.255221 IP 10.1.2.4.49153 > 10.1.3.4.8080: Flags [.], seq 66225:66761, ack 1, win 32768, options [TS val 7255 ecr 7205,eol], length 536: HTTP
7.356401 IP 10.1.3.4.8080 > 10.1.2.4.49153: Flags [.], ack 65689, win 32768, options [TS val 7306 ecr 7154,sack 1 {66225:66761}], length 0
7.356401 IP 10.1.2.4.49153 > 10.1.3.4.8080: Flags [.], seq 66761:67297, ack 1, win 32768, options [TS val 7356 ecr 7306,eol], length 536: HTTP
7.457582 IP 10.1.3.4.8080 > 10.1.2.4.49153: Flags [.], ack 65689, win 32768, options [TS val 7407 ecr 7154,sack 1 {66225:67297}], length 0
7.457582 IP 10.1.2.4.49153 > 10.1.3.4.8080: Flags [.], seq 67297:67833, ack 1, win 32768, options [TS val 7457 ecr 7407,eol], length 536: HTTP
7.558763 IP 10.1.3.4.8080 > 10.1.2.4.49153: Flags [.], ack 65689, win 32768, options [TS val 7508 ecr 7154,sack 1 {66225:67833}], length 0
7.558763 IP 10.1.2.4.49153 > 10.1.3.4.8080: Flags [.], seq 65689:66225, ack 1, win 32768, options [TS val 7558 ecr 7508,eol], length 536: HTTP
7.659930 IP 10.1.3.4.8080 > 10.1.2.4.49153: Flags [.], ack 67833, win 32768, options [TS val 7609 ecr 7558,eol], length 0
7.659930 IP 10.1.2.4.49153 > 10.1.3.4.8080: Flags [.], seq 67833:68369, ack 1, win 32768, options [TS val 7659 ecr 7609,eol], length 536: HTTP
7.659980 IP 10.1.2.4.49153 > 10.1.3.4.8080: Flags [.], seq 68369:68905, ack 1, win 32768, options [TS val 7659 ecr 7609,eol], length 536: HTTP
7.762041 IP 10.1.3.4.8080 > 10.1.2.4.49153: Flags [.], ack 68905, win 32768, options [TS val 7711 ecr 7659,eol], length 0
7.762041 IP 10.1.2.4.49153 > 10.1.3.4.8080: Flags [.], seq 68905:69441, ack 1, win 32768, options [TS val 7762 ecr 7711,eol], length 536: HTTP
7.762091 IP 10.1.2.4.49153 > 10.1.3.4.8080: Flags [.], seq 69441:69977, ack 1, win 32768, options [TS val 7762 ecr 7711,eol], length 536: HTTP
8.063207 IP 10.1.3.4.8080 > 10.1.2.4.49153: Flags [.], ack 69441, win 32768, options [TS val 8013 ecr 7762,eol], length 0
8.063207 IP 10.1.2.4.49153 > 10.1.3.4.8080: Flags [.], seq 69977:70513, ack 1, win 32768, options [TS val 8063 ecr 8013,eol], length 536: HTTP
8.063257 IP 10.1.2.4.49153 > 10.1.3.4.8080: Flags [.], seq 70513:71049, ack 1, win 32768, options [TS val 8063 ecr 8013,eol], length 536: HTTP
8.164387 IP 10.1.3.4.8080 > 10.1.2.4.49153: Flags [.], ack 69441, win 32768, options [TS val 8114 ecr 7762,sack 1 {69977:70513}], length 0
8.164387 IP 10.1.2.4.49153 > 10.1.3.4.8080: Flags [.], seq 71049:71585, ack 1, win 32768, options [TS val 8164 ecr 8114,eol], length 536: HTTP
8.165331 IP 10.1.3.4.8080 > 10.1.2.4.49153: Flags [.], ack 69441, win 32768, options [TS val 8115 ecr 7762,sack 1 {69977:71049}], length 0
8.165331 IP 10.1.2.4.49153 > 10.1.3.4.8080: Flags [.], seq 71585:72121, ack 1, win 32768, options [TS val 8165 ecr 8115,eol], length 536: HTTP
8.265568 IP 10.1.3.4.8080 > 10.1.2.4.49153: Flags [.], ack 69441, win 32768, options [TS val 8215 ecr 7762,sack 1 {69977:71585}], length 0
8.265568 IP 10.1.2.4.49153 > 10.1.3.4.8080: Flags [.], seq 69441:69977, ack 1, win 32768, options [TS val 8265 ecr 8215,eol], length 536: HTTP
8.266512 IP 10.1.3.4.8080 > 10.1.2.4.49153: Flags [.], ack 69441, win 32768, options [TS val 8216 ecr 7762,sack 1 {69977:72121}], length 0
8.266512 IP 10.1.2.4.49153 > 10.1.3.4.8080: Flags [.], seq 72121:72657, ack 1, win 32768, options [TS val 8266 ecr 8216,eol], length 536: HTTP
8.367693 IP 10.1.3.4.8080 > 10.1.2.4.49153: Flags [.], ack 69441, win 32768, options [TS val 8317 ecr 7762,sack 1 {69977:72657}], length 0
8.367693 IP 10.1.2.4.49153 > 10.1.3.4.8080: Flags [.], seq 72657:73193, ack 1, win 32768, options [TS val 8367 ecr 8317,eol], length 536: HTTP
8.468874 IP 10.1.3.4.8080 > 10.1.2.4.49153: Flags [.], ack 69441, win 32768, options [TS val 8418 ecr 7762,sack 1 {69977:73193}], length 0
8.468874 IP 10.1.2.4.49153 > 10.1.3.4.8080: Flags [.], seq 73193:73729, ack 1, win 32768, options [TS val 8468 ecr 8418,eol], length 536: HTTP
8.570055 IP 10.1.3.4.8080 > 10.1.2.4.49153: Flags [.], ack 69441, win 32768, options [TS val 8519 ecr 7762,sack 1 {69977:73729}], length 0
8.570055 IP 10.1.2.4.49153 > 10.1.3.4.8080: Flags [.], seq 73729:74265, ack 1, win 32768, options [TS val 8570 ecr 8519,eol], length 536: HTTP
8.671236 IP 10.1.3.4.8080 > 10.1.2.4.49153: Flags [.], ack 69441, win 32768, options [TS val 8621 ecr 7762,sack 1 {69977:74265}], length 0
8.671236 IP 10.1.2.4.49153 > 10.1.3.4.8080: Flags [.], seq 74265:74801, ack 1, win 32768, options [TS val 8671 ecr 8621,eol], length 536: HTTP
8.772417 IP 10.1.3.4.8080 > 10.1.2.4.49153: Flags [.], ack 69441, win 32768, options [TS val 8722 ecr 7762,sack 1 {69977:74801}], length 0
8.772417 IP 10.1.2.4.49153 > 10.1.3.4.8080: Flags [.], seq 74801:75337, ack 1, win 32768, options [TS val 8772 ecr 8722,eol], length 536: HTTP
8.873598 IP 10.1.3.4.8080 > 10.1.2.4.49153: Flags [.], ack 69441, win 32768, options [TS val 8823 ecr 7762,sack 1 {69977:75337}], length 0
8.873598 IP 10.1.2.4.49153 > 10.1.3.4.8080: Flags [.], seq 75337:75873, ack 1, win 32768, options [TS val 8873 ecr 8823,eol], length 536: HTTP
8.974779 IP 10.1.3.4.8080 > 10.1.2.4.49153: Flags [.], ack 69441, win 32768, options [TS val 8924 ecr 7762,sack 1 {69977:75873}], length 0
8.974779 IP 10.1.2.4.49153 > 10.1.3.4.8080: Flags [.], seq 75873:76409, ack 1, win 32768, options [TS val 8974 ecr 8924,eol], length 536: HTTP
9.063207 IP 10.1.2.4.49153 > 10.1.3.4.8080: Flags [.], seq 69441:69977, ack 1, win 32768, options [TS val 9063 ecr 8924,eol], length 536: HTTP
9.075959 IP 10.1.3.4.8080 > 10.1.2.4.49153: Flags [.], ack 69441, win 32768, options [TS val 9025 ecr 7762,sack 1 {69977:76409}], length 0
9.164372 IP 10.1.3.4.8080 > 10.1.2.4.49153: Flags [.], ack 76409, win 32768, options [TS val 9114 ecr 9063,eol], length 0
9.164372 IP 10.1.2.4.49153 > 10.1.3.4.8080: Flags [.], seq 76409:76945, ack 1, win 32768, options [TS val 9164 ecr 9114,eol], length 536: HTTP
9.465538 IP 10.1.3.4.8080 > 10.1.2.4.49153: Flags [.], ack 76945, win 32768, options [TS val 9415 ecr 9164,eol], length 0
