0.067233 Beacon (ns-3-ssid) [6.0* 9.0 12.0* 18.0 24.0* 36.0 48.0 54.0 Mbit] ESS
0.120034 Assoc Request (ns-3-ssid) [6.0 9.0 12.0 18.0 24.0 36.0 48.0 54.0 Mbit]
0.120326 Assoc Request (ns-3-ssid) [6.0 9.0 12.0 18.0 24.0 36.0 48.0 54.0 Mbit]
0.120482 Acknowledgment RA:00:00:00:00:00:05 
0.120600 Assoc Response AID(1) :: Successful
0.120616 Acknowledgment RA:00:00:00:00:00:06 
0.120871 Assoc Request (ns-3-ssid) [6.0 9.0 12.0 18.0 24.0 36.0 48.0 54.0 Mbit]
0.120931 Acknowledgment RA:00:00:00:00:00:04 
0.121097 Assoc Request (ns-3-ssid) [6.0 9.0 12.0 18.0 24.0 36.0 48.0 54.0 Mbit]
0.121157 Acknowledgment RA:00:00:00:00:00:03 
0.121284 Assoc Response AID(2) :: Successful
0.121344 Acknowledgment RA:00:00:00:00:00:06 
0.121498 Assoc Response AID(3) :: Successful
0.121558 Acknowledgment RA:00:00:00:00:00:06 
0.169633 Beacon (ns-3-ssid) [6.0* 9.0 12.0* 18.0 24.0* 36.0 48.0 54.0 Mbit] ESS
0.272033 Beacon (ns-3-ssid) [6.0* 9.0 12.0* 18.0 24.0* 36.0 48.0 54.0 Mbit] ESS
0.374433 Beacon (ns-3-ssid) [6.0* 9.0 12.0* 18.0 24.0* 36.0 48.0 54.0 Mbit] ESS
0.476833 Beacon (ns-3-ssid) [6.0* 9.0 12.0* 18.0 24.0* 36.0 48.0 54.0 Mbit] ESS
0.579233 Beacon (ns-3-ssid) [6.0* 9.0 12.0* 18.0 24.0* 36.0 48.0 54.0 Mbit] ESS
0.681633 Beacon (ns-3-ssid) [6.0* 9.0 12.0* 18.0 24.0* 36.0 48.0 54.0 Mbit] ESS
0.784033 Beacon (ns-3-ssid) [6.0* 9.0 12.0* 18.0 24.0* 36.0 48.0 54.0 Mbit] ESS
0.886433 Beacon (ns-3-ssid) [6.0* 9.0 12.0* 18.0 24.0* 36.0 48.0 54.0 Mbit] ESS
0.988833 Beacon (ns-3-ssid) [6.0* 9.0 12.0* 18.0 24.0* 36.0 48.0 54.0 Mbit] ESS
1.091233 Beacon (ns-3-ssid) [6.0* 9.0 12.0* 18.0 24.0* 36.0 48.0 54.0 Mbit] ESS
1.193633 Beacon (ns-3-ssid) [6.0* 9.0 12.0* 18.0 24.0* 36.0 48.0 54.0 Mbit] ESS
1.296033 Beacon (ns-3-ssid) [6.0* 9.0 12.0* 18.0 24.0* 36.0 48.0 54.0 Mbit] ESS
1.398433 Beacon (ns-3-ssid) [6.0* 9.0 12.0* 18.0 24.0* 36.0 48.0 54.0 Mbit] ESS
1.500833 Beacon (ns-3-ssid) [6.0* 9.0 12.0* 18.0 24.0* 36.0 48.0 54.0 Mbit] ESS
1.603233 Beacon (ns-3-ssid) [6.0* 9.0 12.0* 18.0 24.0* 36.0 48.0 54.0 Mbit] ESS
1.705633 Beacon (ns-3-ssid) [6.0* 9.0 12.0* 18.0 24.0* 36.0 48.0 54.0 Mbit] ESS
1.808033 Beacon (ns-3-ssid) [6.0* 9.0 12.0* 18.0 24.0* 36.0 48.0 54.0 Mbit] ESS
1.910433 Beacon (ns-3-ssid) [6.0* 9.0 12.0* 18.0 24.0* 36.0 48.0 54.0 Mbit] ESS
2.005034 ARP, Request who-has 10.1.2.4 (ff:ff:ff:ff:ff:ff) tell 10.1.2.3, length 32
2.005206 Acknowledgment RA:00:00:00:00:00:05 
2.005352 ARP, Request who-has 10.1.2.4 (ff:ff:ff:ff:ff:ff) tell 10.1.2.3, length 32
2.005498 ARP, Reply 10.1.2.4 is-at 00:00:00:00:00:06, length 32
2.005514 Acknowledgment RA:00:00:00:00:00:06 
2.005637 IP 10.1.2.3.49153 > 10.1.3.4.8080: Flags [S], seq 0, win 65535, options [TS val 2000 ecr 0,wscale 2,sackOK,eol], length 0
2.005845 Acknowledgment RA:00:00:00:00:00:05 
2.012833 Beacon (ns-3-ssid) [6.0* 9.0 12.0* 18.0 24.0* 36.0 48.0 54.0 Mbit] ESS
2.115233 Beacon (ns-3-ssid) [6.0* 9.0 12.0* 18.0 24.0* 36.0 48.0 54.0 Mbit] ESS
2.123192 ARP, Request who-has 10.1.2.3 (ff:ff:ff:ff:ff:ff) tell 10.1.2.4, length 32
2.123226 ARP, Reply 10.1.2.3 is-at 00:00:00:00:00:05, length 32
2.123398 Acknowledgment RA:00:00:00:00:00:05 
2.123715 IP 10.1.3.4.8080 > 10.1.2.3.49153: Flags [S.], seq 0, ack 1, win 65535, options [TS val 2060 ecr 2000,wscale 2,sackOK,eol], length 0
2.123731 Acknowledgment RA:00:00:00:00:00:06 
2.123809 IP 10.1.2.3.49153 > 10.1.3.4.8080: Flags [.], ack 1, win 32768, options [TS val 2123 ecr 2060,eol], length 0
2.124013 Acknowledgment RA:00:00:00:00:00:05 
2.217633 Beacon (ns-3-ssid) [6.0* 9.0 12.0* 18.0 24.0* 36.0 48.0 54.0 Mbit] ESS
2.320033 Beacon (ns-3-ssid) [6.0* 9.0 12.0* 18.0 24.0* 36.0 48.0 54.0 Mbit] ESS
2.422433 Beacon (ns-3-ssid) [6.0* 9.0 12.0* 18.0 24.0* 36.0 48.0 54.0 Mbit] ESS
2.524833 Beacon (ns-3-ssid) [6.0* 9.0 12.0* 18.0 24.0* 36.0 48.0 54.0 Mbit] ESS
2.627233 Beacon (ns-3-ssid) [6.0* 9.0 12.0* 18.0 24.0* 36.0 48.0 54.0 Mbit] ESS
2.729633 Beacon (ns-3-ssid) [6.0* 9.0 12.0* 18.0 24.0* 36.0 48.0 54.0 Mbit] ESS
2.832033 Beacon (ns-3-ssid) [6.0* 9.0 12.0* 18.0 24.0* 36.0 48.0 54.0 Mbit] ESS
2.934433 Beacon (ns-3-ssid) [6.0* 9.0 12.0* 18.0 24.0* 36.0 48.0 54.0 Mbit] ESS
3.008226 IP 10.1.2.3.49153 > 10.1.3.4.8080: Flags [.], seq 1:537, ack 1, win 32768, options [TS val 3008 ecr 2060,eol], length 536: HTTP
3.009142 Acknowledgment RA:00:00:00:00:00:05 
3.009293 IP 10.1.2.3.49153 > 10.1.3.4.8080: Flags [.], seq 537:1025, ack 1, win 32768, options [TS val 3008 ecr 2060,eol], length 488: HTTP
3.010145 Acknowledgment RA:00:00:00:00:00:05 
3.016417 IP 10.1.2.3.49153 > 10.1.3.4.8080: Flags [.], seq 1025:1561, ack 1, win 32768, options [TS val 3016 ecr 2060,eol], length 536: HTTP
3.017334 Acknowledgment RA:00:00:00:00:00:05 
3.017404 IP 10.1.2.3.49153 > 10.1.3.4.8080: Flags [.], seq 1561:2049, ack 1, win 32768, options [TS val 3016 ecr 2060,eol], length 488: HTTP
3.018256 Acknowledgment RA:00:00:00:00:00:05 
3.024609 IP 10.1.2.3.49153 > 10.1.3.4.8080: Flags [.], seq 2049:2585, ack 1, win 32768, options [TS val 3024 ecr 2060,eol], length 536: HTTP
3.025526 Acknowledgment RA:00:00:00:00:00:05 
3.025605 IP 10.1.2.3.49153 > 10.1.3.4.8080: Flags [.], seq 2585:3073, ack 1, win 32768, options [TS val 3024 ecr 2060,eol], length 488: HTTP
3.026201 Acknowledgment RA:00:00:00:00:00:05 
3.032801 IP 10.1.2.3.49153 > 10.1.3.4.8080: Flags [.], seq 3073:3609, ack 1, win 32768, options [TS val 3032 ecr 2060,eol], length 536: HTTP
3.033442 Acknowledgment RA:00:00:00:00:00:05 
3.033575 IP 10.1.2.3.49153 > 10.1.3.4.8080: Flags [.], seq 3609:4097, ack 1, win 32768, options [TS val 3032 ecr 2060,eol], length 488: HTTP
3.034171 Acknowledgment RA:00:00:00:00:00:05 
3.036833 Beacon (ns-3-ssid) [6.0* 9.0 12.0* 18.0 24.0* 36.0 48.0 54.0 Mbit] ESS
3.040993 IP 10.1.2.3.49153 > 10.1.3.4.8080: Flags [.], seq 4097:4633, ack 1, win 32768, options [TS val 3040 ecr 2060,eol], length 536: HTTP
3.041634 Acknowledgment RA:00:00:00:00:00:05 
3.041794 IP 10.1.2.3.49153 > 10.1.3.4.8080: Flags [.], seq 4633:5121, ack 1, win 32768, options [TS val 3040 ecr 2060,eol], length 488: HTTP
3.042390 Acknowledgment RA:00:00:00:00:00:05 
3.111302 IP 10.1.3.4.8080 > 10.1.2.3.49153: Flags [.], ack 1, win 32768, options [TS val 3061 ecr 2123,sack 1 {537:1025}], length 0
3.111318 Acknowledgment RA:00:00:00:00:00:06 
3.111396 IP 10.1.2.3.49153 > 10.1.3.4.8080: Flags [.], seq 5121:5657, ack 1, win 32768, options [TS val 3111 ecr 3061,eol], length 536: HTTP
3.112036 Acknowledgment RA:00:00:00:00:00:05 
3.118572 IP 10.1.3.4.8080 > 10.1.2.3.49153: Flags [.], ack 1, win 32768, options [TS val 3068 ecr 2123,sack 1 {537:1561}], length 0
3.118588 Acknowledgment RA:00:00:00:00:00:06 
3.118666 IP 10.1.2.3.49153 > 10.1.3.4.8080: Flags [.], seq 5657:6193, ack 1, win 32768, options [TS val 3118 ecr 3068,eol], length 536: HTTP
3.119306 Acknowledgment RA:00:00:00:00:00:05 
3.119546 IP 10.1.3.4.8080 > 10.1.2.3.49153: Flags [.], ack 1, win 32768, options [TS val 3069 ecr 2123,sack 1 {537:2049}], length 0
3.119562 Acknowledgment RA:00:00:00:00:00:06 
3.119667 IP 10.1.2.3.49153 > 10.1.3.4.8080: Flags [.], seq 1:537, ack 1, win 32768, options [TS val 3119 ecr 3069,eol], length 536: HTTP
3.120307 Acknowledgment RA:00:00:00:00:00:05 
3.126764 IP 10.1.3.4.8080 > 10.1.2.3.49153: Flags [.], ack 1, win 32768, options [TS val 3076 ecr 2123,sack 1 {537:2585}], length 0
3.126780 Acknowledgment RA:00:00:00:00:00:06 
3.127627 IP 10.1.3.4.8080 > 10.1.2.3.49153: Flags [.], ack 1, win 32768, options [TS val 3077 ecr 2123,sack 1 {537:3073}], length 0
3.127643 Acknowledgment RA:00:00:00:00:00:06 
3.134680 IP 10.1.3.4.8080 > 10.1.2.3.49153: Flags [.], ack 1, win 32768, options [TS val 3084 ecr 2123,sack 1 {537:3609}], length 0
3.134696 Acknowledgment RA:00:00:00:00:00:06 
3.135543 IP 10.1.3.4.8080 > 10.1.2.3.49153: Flags [.], ack 1, win 32768, options [TS val 3085 ecr 2123,sack 1 {537:4097}], length 0
3.135559 Acknowledgment RA:00:00:00:00:00:06 
3.139233 Beacon (ns-3-ssid) [6.0* 9.0 12.0* 18.0 24.0* 36.0 48.0 54.0 Mbit] ESS
3.142828 IP 10.1.3.4.8080 > 10.1.2.3.49153: Flags [.], ack 1, win 32768, options [TS val 3092 ecr 2123,sack 1 {537:4633}], length 0
3.142844 Acknowledgment RA:00:00:00:00:00:06 
3.143691 IP 10.1.3.4.8080 > 10.1.2.3.49153: Flags [.], ack 1, win 32768, options [TS val 3093 ecr 2123,sack 1 {537:5121}], length 0
3.143707 Acknowledgment RA:00:00:00:00:00:06 
3.213230 IP 10.1.3.4.8080 > 10.1.2.3.49153: Flags [.], ack 1, win 32768, options [TS val 3162 ecr 2123,sack 1 {537:5657}], length 0
3.213246 Acknowledgment RA:00:00:00:00:00:06 
3.213324 IP 10.1.2.3.49153 > 10.1.3.4.8080: Flags [.], seq 6193:6729, ack 1, win 32768, options [TS val 3213 ecr 3162,eol], length 536: HTTP
3.213964 Acknowledgment RA:00:00:00:00:00:05 
3.220500 IP 10.1.3.4.8080 > 10.1.2.3.49153: Flags [.], ack 1, win 32768, options [TS val 3170 ecr 2123,sack 1 {537:6193}], length 0
3.220516 Acknowledgment RA:00:00:00:00:00:06 
3.220594 IP 10.1.2.3.49153 > 10.1.3.4.8080: Flags [.], seq 6729:7265, ack 1, win 32768, options [TS val 3220 ecr 3170,eol], length 536: HTTP
3.221234 Acknowledgment RA:00:00:00:00:00:05 
3.221483 IP 10.1.3.4.8080 > 10.1.2.3.49153: Flags [.], ack 6193, win 32768, options [TS val 3171 ecr 3119,eol], length 0
3.221499 Acknowledgment RA:00:00:00:00:00:06 
3.221577 IP 10.1.2.3.49153 > 10.1.3.4.8080: Flags [.], seq 7265:7801, ack 1, win 32768, options [TS val 3221 ecr 3171,eol], length 536: HTTP
3.222065 Acknowledgment RA:00:00:00:00:00:05 
3.222234 IP 10.1.2.3.49153 > 10.1.3.4.8080: Flags [.], seq 7801:8337, ack 1, win 32768, options [TS val 3221 ecr 3171,eol], length 536: HTTP
3.222723 Acknowledgment RA:00:00:00:00:00:05 
3.241633 Beacon (ns-3-ssid) [6.0* 9.0 12.0* 18.0 24.0* 36.0 48.0 54.0 Mbit] ESS
3.322410 IP 10.1.3.4.8080 > 10.1.2.3.49153: Flags [.], ack 7265, win 32768, options [TS val 3272 ecr 3213,eol], length 0
3.322426 Acknowledgment RA:00:00:00:00:00:06 
3.322504 IP 10.1.2.3.49153 > 10.1.3.4.8080: Flags [.], seq 8337:8873, ack 1, win 32768, options [TS val 3322 ecr 3272,eol], length 536: HTTP
3.322993 Acknowledgment RA:00:00:00:00:00:05 
3.323090 IP 10.1.2.3.49153 > 10.1.3.4.8080: Flags [.], seq 8873:9409, ack 1, win 32768, options [TS val 3322 ecr 3272,eol], length 536: HTTP
3.323578 Acknowledgment RA:00:00:00:00:00:05 
3.324298 IP 10.1.3.4.8080 > 10.1.2.3.49153: Flags [.], ack 8337, win 32768, options [TS val 3274 ecr 3221,eol], length 0
3.324314 Acknowledgment RA:00:00:00:00:00:06 
3.324392 IP 10.1.2.3.49153 > 10.1.3.4.8080: Flags [.], seq 9409:9945, ack 1, win 32768, options [TS val 3324 ecr 3274,eol], length 536: HTTP
3.324881 Acknowledgment RA:00:00:00:00:00:05 
3.324960 IP 10.1.2.3.49153 > 10.1.3.4.8080: Flags [.], seq 9945:10481, ack 1, win 32768, options [TS val 3324 ecr 3274,eol], length 536: HTTP
3.325448 Acknowledgment RA:00:00:00:00:00:05 
3.344033 Beacon (ns-3-ssid) [6.0* 9.0 12.0* 18.0 24.0* 36.0 48.0 54.0 Mbit] ESS
3.425125 IP 10.1.3.4.8080 > 10.1.2.3.49153: Flags [.], ack 9409, win 32768, options [TS val 3374 ecr 3322,eol], length 0
3.425141 Acknowledgment RA:00:00:00:00:00:06 
3.425219 IP 10.1.2.3.49153 > 10.1.3.4.8080: Flags [.], seq 10481:11017, ack 1, win 32768, options [TS val 3425 ecr 3374,eol], length 536: HTTP
3.425707 Acknowledgment RA:00:00:00:00:00:05 
3.425759 IP 10.1.2.3.49153 > 10.1.3.4.8080: Flags [.], seq 11017:11553, ack 1, win 32768, options [TS val 3425 ecr 3374,eol], length 536: HTTP
3.426247 Acknowledgment RA:00:00:00:00:00:05 
3.427013 IP 10.1.3.4.8080 > 10.1.2.3.49153: Flags [.], ack 10481, win 32768, options [TS val 3376 ecr 3324,eol], length 0
3.427029 Acknowledgment RA:00:00:00:00:00:06 
3.427107 IP 10.1.2.3.49153 > 10.1.3.4.8080: Flags [.], seq 11553:12089, ack 1, win 32768, options [TS val 3427 ecr 3376,eol], length 536: HTTP
3.427595 Acknowledgment RA:00:00:00:00:00:05 
3.427647 IP 10.1.2.3.49153 > 10.1.3.4.8080: Flags [.], seq 12089:12625, ack 1, win 32768, options [TS val 3427 ecr 3376,eol], length 536: HTTP
3.428135 Acknowledgment RA:00:00:00:00:00:05 
3.428268 IP 10.1.2.3.49153 > 10.1.3.4.8080: Flags [.], seq 12625:13161, ack 1, win 32768, options [TS val 3427 ecr 3376,eol], length 536: HTTP
3.428616 Acknowledgment RA:00:00:00:00:00:05 
3.446433 Beacon (ns-3-ssid) [6.0* 9.0 12.0* 18.0 24.0* 36.0 48.0 54.0 Mbit] ESS
3.527840 IP 10.1.3.4.8080 > 10.1.2.3.49153: Flags [.], ack 11553, win 32768, options [TS val 3477 ecr 3425,eol], length 0
3.527856 Acknowledgment RA:00:00:00:00:00:06 
3.527934 IP 10.1.2.3.49153 > 10.1.3.4.8080: Flags [.], seq 13161:13697, ack 1, win 32768, options [TS val 3527 ecr 3477,eol], length 536: HTTP
3.528282 Acknowledgment RA:00:00:00:00:00:05 
3.528361 IP 10.1.2.3.49153 > 10.1.3.4.8080: Flags [.], seq 13697:14233, ack 1, win 32768, options [TS val 3527 ecr 3477,eol], length 536: HTTP
3.528709 Acknowledgment RA:00:00:00:00:00:05 
3.529725 IP 10.1.3.4.8080 > 10.1.2.3.49153: Flags [.], ack 11553, win 32768, options [TS val 3479 ecr 3425,sack 1 {12089:12625}], length 0
3.529741 Acknowledgment RA:00:00:00:00:00:06 
3.529807 IP 10.1.2.3.49153 > 10.1.3.4.8080: Flags [.], seq 14233:14769, ack 1, win 32768, options [TS val 3529 ecr 3479,eol], length 536: HTTP
3.530155 Acknowledgment RA:00:00:00:00:00:05 
3.548833 Beacon (ns-3-ssid) [6.0* 9.0 12.0* 18.0 24.0* 36.0 48.0 54.0 Mbit] ESS
3.629485 IP 10.1.3.4.8080 > 10.1.2.3.49153: Flags [.], ack 11553, win 32768, options [TS val 3579 ecr 3425,sack 2 {13161:13697}{12089:12625}], length 0
3.629501 Acknowledgment RA:00:00:00:00:00:06 
3.629567 IP 10.1.2.3.49153 > 10.1.3.4.8080: Flags [.], seq 14769:15305, ack 1, win 32768, options [TS val 3629 ecr 3579,eol], length 536: HTTP
3.629915 Acknowledgment RA:00:00:00:00:00:05 
3.630429 IP 10.1.3.4.8080 > 10.1.2.3.49153: Flags [.], ack 11553, win 32768, options [TS val 3580 ecr 3425,sack 2 {13161:14233}{12089:12625}], length 0
3.630445 Acknowledgment RA:00:00:00:00:00:06 
3.630511 IP 10.1.2.3.49153 > 10.1.3.4.8080: Flags [.], seq 11553:12089, ack 1, win 32768, options [TS val 3630 ecr 3580,eol], length 536: HTTP
3.630859 Acknowledgment RA:00:00:00:00:00:05 
3.651233 Beacon (ns-3-ssid) [6.0* 9.0 12.0* 18.0 24.0* 36.0 48.0 54.0 Mbit] ESS
3.731140 IP 10.1.3.4.8080 > 10.1.2.3.49153: Flags [.], ack 11553, win 32768, options [TS val 3680 ecr 3425,sack 3 {14769:15305}{13161:14233}{12089:12625}], length 0
3.731156 Acknowledgment RA:00:00:00:00:00:06 
3.753633 Beacon (ns-3-ssid) [6.0* 9.0 12.0* 18.0 24.0* 36.0 48.0 54.0 Mbit] ESS
3.856033 Beacon (ns-3-ssid) [6.0* 9.0 12.0* 18.0 24.0* 36.0 48.0 54.0 Mbit] ESS
3.958433 Beacon (ns-3-ssid) [6.0* 9.0 12.0* 18.0 24.0* 36.0 48.0 54.0 Mbit] ESS
4.060833 Beacon (ns-3-ssid) [6.0* 9.0 12.0* 18.0 24.0* 36.0 48.0 54.0 Mbit] ESS
4.163233 Beacon (ns-3-ssid) [6.0* 9.0 12.0* 18.0 24.0* 36.0 48.0 54.0 Mbit] ESS
4.265633 Beacon (ns-3-ssid) [6.0* 9.0 12.0* 18.0 24.0* 36.0 48.0 54.0 Mbit] ESS
4.368033 Beacon (ns-3-ssid) [6.0* 9.0 12.0* 18.0 24.0* 36.0 48.0 54.0 Mbit] ESS
4.470433 Beacon (ns-3-ssid) [6.0* 9.0 12.0* 18.0 24.0* 36.0 48.0 54.0 Mbit] ESS
4.527874 IP 10.1.2.3.49153 > 10.1.3.4.8080: Flags [.], seq 11553:12089, ack 1, win 32768, options [TS val 4527 ecr 3680,eol], length 536: HTTP
4.528222 Acknowledgment RA:00:00:00:00:00:05 
4.572833 Beacon (ns-3-ssid) [6.0* 9.0 12.0* 18.0 24.0* 36.0 48.0 54.0 Mbit] ESS
4.629425 IP 10.1.3.4.8080 > 10.1.2.3.49153: Flags [.], ack 12625, win 32768, options [TS val 4579 ecr 4527,sack 2 {14769:15305}{13161:14233}], length 0
4.629441 Acknowledgment RA:00:00:00:00:00:06 
4.629507 IP 10.1.2.3.49153 > 10.1.3.4.8080: Flags [.], seq 12625:13161, ack 1, win 32768, options [TS val 4629 ecr 4579,eol], length 536: HTTP
4.629855 Acknowledgment RA:00:00:00:00:00:05 
4.629934 IP 10.1.2.3.49153 > 10.1.3.4.8080: Flags [.], seq 14233:14769, ack 1, win 32768, options [TS val 4629 ecr 4579,eol], length 536: HTTP
4.630283 Acknowledgment RA:00:00:00:00:00:05 
4.675233 Beacon (ns-3-ssid) [6.0* 9.0 12.0* 18.0 24.0* 36.0 48.0 54.0 Mbit] ESS
4.731041 IP 10.1.3.4.8080 > 10.1.2.3.49153: Flags [.], ack 14233, win 32768, options [TS val 4680 ecr 4629,sack 1 {14769:15305}], length 0
4.731057 Acknowledgment RA:00:00:00:00:00:06 
4.731123 IP 10.1.2.3.49153 > 10.1.3.4.8080: Flags [.], seq 15305:15841, ack 1, win 32768, options [TS val 4731 ecr 4680,eol], length 536: HTTP
4.731472 Acknowledgment RA:00:00:00:00:00:05 
4.731968 IP 10.1.3.4.8080 > 10.1.2.3.49153: Flags [.], ack 15305, win 32768, options [TS val 4681 ecr 4629,eol], length 0
4.731984 Acknowledgment RA:00:00:00:00:00:06 
4.732050 IP 10.1.2.3.49153 > 10.1.3.4.8080: Flags [.], seq 15841:16377, ack 1, win 32768, options [TS val 4731 ecr 4681,eol], length 536: HTTP
4.732326 Acknowledgment RA:00:00:00:00:00:05 
4.777633 Beacon (ns-3-ssid) [6.0* 9.0 12.0* 18.0 24.0* 36.0 48.0 54.0 Mbit] ESS
4.833584 IP 10.1.3.4.8080 > 10.1.2.3.49153: Flags [.], ack 16377, win 32768, options [TS val 4783 ecr 4731,eol], length 0
4.833600 Acknowledgment RA:00:00:00:00:00:06 
4.833666 IP 10.1.2.3.49153 > 10.1.3.4.8080: Flags [.], seq 16377:16913, ack 1, win 32768, options [TS val 4833 ecr 4783,eol], length 536: HTTP
4.833942 Acknowledgment RA:00:00:00:00:00:05 
4.834084 IP 10.1.2.3.49153 > 10.1.3.4.8080: Flags [.], seq 16913:17449, ack 1, win 32768, options [TS val 4833 ecr 4783,eol], length 536: HTTP
4.834360 Acknowledgment RA:00:00:00:00:00:05 
4.834529 IP 10.1.2.3.49153 > 10.1.3.4.8080: Flags [.], seq 17449:17985, ack 1, win 32768, options [TS val 4833 ecr 4783,eol], length 536: HTTP
4.834805 Acknowledgment RA:00:00:00:00:00:05 
4.880033 Beacon (ns-3-ssid) [6.0* 9.0 12.0* 18.0 24.0* 36.0 48.0 54.0 Mbit] ESS
4.936059 IP 10.1.3.4.8080 > 10.1.2.3.49153: Flags [.], ack 17449, win 32768, options [TS val 4885 ecr 4833,eol], length 0
4.936075 Acknowledgment RA:00:00:00:00:00:06 
4.936141 IP 10.1.2.3.49153 > 10.1.3.4.8080: Flags [.], seq 17985:18521, ack 1, win 32768, options [TS val 4936 ecr 4885,eol], length 536: HTTP
4.936417 Acknowledgment RA:00:00:00:00:00:05 
4.936487 IP 10.1.2.3.49153 > 10.1.3.4.8080: Flags [.], seq 18521:19057, ack 1, win 32768, options [TS val 4936 ecr 4885,eol], length 536: HTTP
4.936763 Acknowledgment RA:00:00:00:00:00:05 
4.982433 Beacon (ns-3-ssid) [6.0* 9.0 12.0* 18.0 24.0* 36.0 48.0 54.0 Mbit] ESS
5.037590 IP 10.1.3.4.8080 > 10.1.2.3.49153: Flags [.], ack 18521, win 32768, options [TS val 4987 ecr 4833,eol], length 0
5.037606 Acknowledgment RA:00:00:00:00:00:06 
5.037672 IP 10.1.2.3.49153 > 10.1.3.4.8080: Flags [.], seq 19057:19593, ack 1, win 32768, options [TS val 5037 ecr 4987,eol], length 536: HTTP
5.037948 Acknowledgment RA:00:00:00:00:00:05 
5.037982 IP 10.1.2.3.49153 > 10.1.3.4.8080: Flags [.], seq 19593:20129, ack 1, win 32768, options [TS val 5037 ecr 4987,eol], length 536: HTTP
5.038258 Acknowledgment RA:00:00:00:00:00:05 
5.084833 Beacon (ns-3-ssid) [6.0* 9.0 12.0* 18.0 24.0* 36.0 48.0 54.0 Mbit] ESS
5.139100 IP 10.1.3.4.8080 > 10.1.2.3.49153: Flags [.], ack 19593, win 32768, options [TS val 5088 ecr 4936,eol], length 0
5.139116 Acknowledgment RA:00:00:00:00:00:06 
5.139182 IP 10.1.2.3.49153 > 10.1.3.4.8080: Flags [.], seq 20129:20665, ack 1, win 32768, options [TS val 5139 ecr 5088,eol], length 536: HTTP
5.139458 Acknowledgment RA:00:00:00:00:00:05 
5.139564 IP 10.1.2.3.49153 > 10.1.3.4.8080: Flags [.], seq 20665:21201, ack 1, win 32768, options [TS val 5139 ecr 5088,eol], length 536: HTTP
5.139840 Acknowledgment RA:00:00:00:00:00:05 
5.139874 IP 10.1.2.3.49153 > 10.1.3.4.8080: Flags [.], seq 21201:21737, ack 1, win 32768, options [TS val 5139 ecr 5088,eol], length 536: HTTP
5.140079 Acknowledgment RA:00:00:00:00:00:05 
5.187233 Beacon (ns-3-ssid) [6.0* 9.0 12.0* 18.0 24.0* 36.0 48.0 54.0 Mbit] ESS
5.240611 IP 10.1.3.4.8080 > 10.1.2.3.49153: Flags [.], ack 20665, win 32768, options [TS val 5190 ecr 5037,eol], length 0
5.240627 Acknowledgment RA:00:00:00:00:00:06 
5.240693 IP 10.1.2.3.49153 > 10.1.3.4.8080: Flags [.], seq 21737:22273, ack 1, win 32768, options [TS val 5240 ecr 5190,eol], length 536: HTTP
5.240897 Acknowledgment RA:00:00:00:00:00:05 
5.240967 IP 10.1.2.3.49153 > 10.1.3.4.8080: Flags [.], seq 22273:22809, ack 1, win 32768, options [TS val 5240 ecr 5190,eol], length 536: HTTP
5.241171 Acknowledgment RA:00:00:00:00:00:05 
5.242499 IP 10.1.3.4.8080 > 10.1.2.3.49153: Flags [.], ack 21737, win 32768, options [TS val 5192 ecr 5139,eol], length 0
5.242515 Acknowledgment RA:00:00:00:00:00:06 
5.242581 IP 10.1.2.3.49153 > 10.1.3.4.8080: Flags [.], seq 22809:23345, ack 1, win 32768, options [TS val 5242 ecr 5192,eol], length 536: HTTP
5.242785 Acknowledgment RA:00:00:00:00:00:05 
5.242855 IP 10.1.2.3.49153 > 10.1.3.4.8080: Flags [.], seq 23345:23881, ack 1, win 32768, options [TS val 5242 ecr 5192,eol], length 536: HTTP
5.243059 Acknowledgment RA:00:00:00:00:00:05 
5.289633 Beacon (ns-3-ssid) [6.0* 9.0 12.0* 18.0 24.0* 36.0 48.0 54.0 Mbit] ESS
5.342994 IP 10.1.3.4.8080 > 10.1.2.3.49153: Flags [.], ack 22809, win 32768, options [TS val 5292 ecr 5240,eol], length 0
5.343010 Acknowledgment RA:00:00:00:00:00:06 
5.343076 IP 10.1.2.3.49153 > 10.1.3.4.8080: Flags [.], seq 23881:24417, ack 1, win 32768, options [TS val 5342 ecr 5292,eol], length 536: HTTP
5.343280 Acknowledgment RA:00:00:00:00:00:05 
5.343422 IP 10.1.2.3.49153 > 10.1.3.4.8080: Flags [.], seq 24417:24953, ack 1, win 32768, options [TS val 5342 ecr 5292,eol], length 536: HTTP
5.343626 Acknowledgment RA:00:00:00:00:00:05 
5.344882 IP 10.1.3.4.8080 > 10.1.2.3.49153: Flags [.], ack 23881, win 32768, options [TS val 5294 ecr 5242,eol], length 0
5.344898 Acknowledgment RA:00:00:00:00:00:06 
5.344964 IP 10.1.2.3.49153 > 10.1.3.4.8080: Flags [.], seq 24953:25489, ack 1, win 32768, options [TS val 5344 ecr 5294,eol], length 536: HTTP
5.345168 Acknowledgment RA:00:00:00:00:00:05 
5.345292 IP 10.1.2.3.49153 > 10.1.3.4.8080: Flags [.], seq 25489:26025, ack 1, win 32768, options [TS val 5344 ecr 5294,eol], length 536: HTTP
5.345496 Acknowledgment RA:00:00:00:00:00:05 
5.392033 Beacon (ns-3-ssid) [6.0* 9.0 12.0* 18.0 24.0* 36.0 48.0 54.0 Mbit] ESS
5.445376 IP 10.1.3.4.8080 > 10.1.2.3.49153: Flags [.], ack 24953, win 32768, options [TS val 5395 ecr 5342,eol], length 0
5.445392 Acknowledgment RA:00:00:00:00:00:06 
5.445458 IP 10.1.2.3.49153 > 10.1.3.4.8080: Flags [.], seq 26025:26561, ack 1, win 32768, options [TS val 5445 ecr 5395,eol], length 536: HTTP
5.445662 Acknowledgment RA:00:00:00:00:00:05 
5.445786 IP 10.1.2.3.49153 > 10.1.3.4.8080: Flags [.], seq 26561:27097, ack 1, win 32768, options [TS val 5445 ecr 5395,eol], length 536: HTTP
5.445958 Acknowledgment RA:00:00:00:00:00:05 
5.446019 IP 10.1.2.3.49153 > 10.1.3.4.8080: Flags [.], seq 27097:27633, ack 1, win 32768, options [TS val 5445 ecr 5395,eol], length 536: HTTP
5.446192 Acknowledgment RA:00:00:00:00:00:05 
5.447264 IP 10.1.3.4.8080 > 10.1.2.3.49153: Flags [.], ack 26025, win 32768, options [TS val 5397 ecr 5344,eol], length 0
5.447280 Acknowledgment RA:00:00:00:00:00:06 
5.447346 IP 10.1.2.3.49153 > 10.1.3.4.8080: Flags [.], seq 27633:28169, ack 1, win 32768, options [TS val 5447 ecr 5397,eol], length 536: HTTP
5.447518 Acknowledgment RA:00:00:00:00:00:05 
5.447588 IP 10.1.2.3.49153 > 10.1.3.4.8080: Flags [.], seq 28169:28705, ack 1, win 32768, options [TS val 5447 ecr 5397,eol], length 536: HTTP
5.447760 Acknowledgment RA:00:00:00:00:00:05 
5.494433 Beacon (ns-3-ssid) [6.0* 9.0 12.0* 18.0 24.0* 36.0 48.0 54.0 Mbit] ESS
5.547759 IP 10.1.3.4.8080 > 10.1.2.3.49153: Flags [.], ack 27097, win 32768, options [TS val 5497 ecr 5445,eol], length 0
5.547775 Acknowledgment RA:00:00:00:00:00:06 
5.547841 IP 10.1.2.3.49153 > 10.1.3.4.8080: Flags [.], seq 28705:29241, ack 1, win 32768, options [TS val 5547 ecr 5497,eol], length 536: HTTP
5.548013 Acknowledgment RA:00:00:00:00:00:05 
5.548056 IP 10.1.2.3.49153 > 10.1.3.4.8080: Flags [.], seq 29241:29777, ack 1, win 32768, options [TS val 5547 ecr 5497,eol], length 536: HTTP
5.548228 Acknowledgment RA:00:00:00:00:00:05 
5.549647 IP 10.1.3.4.8080 > 10.1.2.3.49153: Flags [.], ack 28169, win 32768, options [TS val 5499 ecr 5445,eol], length 0
5.549663 Acknowledgment RA:00:00:00:00:00:06 
5.549729 IP 10.1.2.3.49153 > 10.1.3.4.8080: Flags [.], seq 29777:30313, ack 1, win 32768, options [TS val 5549 ecr 5499,eol], length 536: HTTP
5.549901 Acknowledgment RA:00:00:00:00:00:05 
5.550052 IP 10.1.2.3.49153 > 10.1.3.4.8080: Flags [.], seq 30313:30849, ack 1, win 32768, options [TS val 5549 ecr 5499,eol], length 536: HTTP
5.550224 Acknowledgment RA:00:00:00:00:00:05 
5.596833 Beacon (ns-3-ssid) [6.0* 9.0 12.0* 18.0 24.0* 36.0 48.0 54.0 Mbit] ESS
5.649166 IP 10.1.3.4.8080 > 10.1.2.3.49153: Flags [.], ack 29241, win 32768, options [TS val 5598 ecr 5447,eol], length 0
5.649182 Acknowledgment RA:00:00:00:00:00:06 
5.649248 IP 10.1.2.3.49153 > 10.1.3.4.8080: Flags [.], seq 30849:31385, ack 1, win 32768, options [TS val 5649 ecr 5598,eol], length 536: HTTP
5.649420 Acknowledgment RA:00:00:00:00:00:05 
5.649535 IP 10.1.2.3.49153 > 10.1.3.4.8080: Flags [.], seq 31385:31921, ack 1, win 32768, options [TS val 5649 ecr 5598,eol], length 536: HTTP
5.649707 Acknowledgment RA:00:00:00:00:00:05 
5.651042 IP 10.1.3.4.8080 > 10.1.2.3.49153: Flags [.], ack 30313, win 32768, options [TS val 5600 ecr 5547,eol], length 0
5.651058 Acknowledgment RA:00:00:00:00:00:06 
5.651120 IP 10.1.2.3.49153 > 10.1.3.4.8080: Flags [.], seq 31921:32457, ack 1, win 32768, options [TS val 5651 ecr 5600,eol], length 536: HTTP
5.651280 Acknowledgment RA:00:00:00:00:00:05 
5.651386 IP 10.1.2.3.49153 > 10.1.3.4.8080: Flags [.], seq 32457:32993, ack 1, win 32768, options [TS val 5651 ecr 5600,eol], length 536: HTTP
5.651546 Acknowledgment RA:00:00:00:00:00:05 
5.651670 IP 10.1.2.3.49153 > 10.1.3.4.8080: Flags [.], seq 32993:33529, ack 1, win 32768, options [TS val 5651 ecr 5600,eol], length 536: HTTP
5.651830 Acknowledgment RA:00:00:00:00:00:05 
5.699233 Beacon (ns-3-ssid) [6.0* 9.0 12.0* 18.0 24.0* 36.0 48.0 54.0 Mbit] ESS
5.750560 IP 10.1.3.4.8080 > 10.1.2.3.49153: Flags [.], ack 31385, win 32768, options [TS val 5700 ecr 5549,eol], length 0
5.750576 Acknowledgment RA:00:00:00:00:00:06 
5.750638 IP 10.1.2.3.49153 > 10.1.3.4.8080: Flags [.], seq 33529:34065, ack 1, win 32768, options [TS val 5750 ecr 5700,eol], length 536: HTTP
5.750798 Acknowledgment RA:00:00:00:00:00:05 
5.750886 IP 10.1.2.3.49153 > 10.1.3.4.8080: Flags [.], seq 34065:34601, ack 1, win 32768, options [TS val 5750 ecr 5700,eol], length 536: HTTP
5.751047 Acknowledgment RA:00:00:00:00:00:05 
5.752448 IP 10.1.3.4.8080 > 10.1.2.3.49153: Flags [.], ack 32457, win 32768, options [TS val 5702 ecr 5649,eol], length 0
5.752464 Acknowledgment RA:00:00:00:00:00:06 
5.752526 IP 10.1.2.3.49153 > 10.1.3.4.8080: Flags [.], seq 34601:35137, ack 1, win 32768, options [TS val 5752 ecr 5702,eol], length 536: HTTP
5.752686 Acknowledgment RA:00:00:00:00:00:05 
5.752828 IP 10.1.2.3.49153 > 10.1.3.4.8080: Flags [.], seq 35137:35673, ack 1, win 32768, options [TS val 5752 ecr 5702,eol], length 536: HTTP
5.752989 Acknowledgment RA:00:00:00:00:00:05 
5.754336 IP 10.1.3.4.8080 > 10.1.2.3.49153: Flags [.], ack 33529, win 32768, options [TS val 5704 ecr 5651,eol], length 0
5.754352 Acknowledgment RA:00:00:00:00:00:06 
5.754414 IP 10.1.2.3.49153 > 10.1.3.4.8080: Flags [.], seq 35673:36209, ack 1, win 32768, options [TS val 5754 ecr 5704,eol], length 536: HTTP
5.754574 Acknowledgment RA:00:00:00:00:00:05 
5.754716 IP 10.1.2.3.49153 > 10.1.3.4.8080: Flags [.], seq 36209:36745, ack 1, win 32768, options [TS val 5754 ecr 5704,eol], length 536: HTTP
5.754877 Acknowledgment RA:00:00:00:00:00:05 
5.801633 Beacon (ns-3-ssid) [6.0* 9.0 12.0* 18.0 24.0* 36.0 48.0 54.0 Mbit] ESS
5.852883 IP 10.1.3.4.8080 > 10.1.2.3.49153: Flags [.], ack 34601, win 32768, options [TS val 5802 ecr 5750,eol], length 0
5.852899 Acknowledgment RA:00:00:00:00:00:06 
5.852961 IP 10.1.2.3.49153 > 10.1.3.4.8080: Flags [.], seq 36745:37281, ack 1, win 32768, options [TS val 5852 ecr 5802,eol], length 536: HTTP
5.853121 Acknowledgment RA:00:00:00:00:00:05 
5.853182 IP 10.1.2.3.49153 > 10.1.3.4.8080: Flags [.], seq 37281:37817, ack 1, win 32768, options [TS val 5852 ecr 5802,eol], length 536: HTTP
5.853342 Acknowledgment RA:00:00:00:00:00:05 
5.855732 IP 10.1.3.4.8080 > 10.1.2.3.49153: Flags [.], ack 35137, win 32768, options [TS val 5805 ecr 5752,sack 1 {35673:36209}], length 0
5.855748 Acknowledgment RA:00:00:00:00:00:06 
5.855810 IP 10.1.2.3.49153 > 10.1.3.4.8080: Flags [.], seq 37817:38353, ack 1, win 32768, options [TS val 5855 ecr 5805,eol], length 536: HTTP
5.855971 Acknowledgment RA:00:00:00:00:00:05 
5.856095 IP 10.1.2.3.49153 > 10.1.3.4.8080: Flags [.], seq 38353:38889, ack 1, win 32768, options [TS val 5855 ecr 5805,eol], length 536: HTTP
5.856255 Acknowledgment RA:00:00:00:00:00:05 
5.856676 IP 10.1.3.4.8080 > 10.1.2.3.49153: Flags [.], ack 35137, win 32768, options [TS val 5806 ecr 5752,sack 1 {35673:36745}], length 0
5.856692 Acknowledgment RA:00:00:00:00:00:06 
5.856754 IP 10.1.2.3.49153 > 10.1.3.4.8080: Flags [.], seq 38889:39425, ack 1, win 32768, options [TS val 5856 ecr 5806,eol], length 536: HTTP
5.856915 Acknowledgment RA:00:00:00:00:00:05 
5.904033 Beacon (ns-3-ssid) [6.0* 9.0 12.0* 18.0 24.0* 36.0 48.0 54.0 Mbit] ESS
5.954279 IP 10.1.3.4.8080 > 10.1.2.3.49153: Flags [.], ack 35137, win 32768, options [TS val 5904 ecr 5752,sack 1 {35673:37281}], length 0
5.954295 Acknowledgment RA:00:00:00:00:00:06 
5.954357 IP 10.1.2.3.49153 > 10.1.3.4.8080: Flags [.], seq 35137:35673, ack 1, win 32768, options [TS val 5954 ecr 5904,eol], length 536: HTTP
5.954517 Acknowledgment RA:00:00:00:00:00:05 
5.955223 IP 10.1.3.4.8080 > 10.1.2.3.49153: Flags [.], ack 35137, win 32768, options [TS val 5905 ecr 5752,sack 1 {35673:37817}], length 0
5.955239 Acknowledgment RA:00:00:00:00:00:06 
5.957129 IP 10.1.3.4.8080 > 10.1.2.3.49153: Flags [.], ack 35137, win 32768, options [TS val 5906 ecr 5752,sack 1 {35673:38353}], length 0
5.957145 Acknowledgment RA:00:00:00:00:00:06 
5.958061 IP 10.1.3.4.8080 > 10.1.2.3.49153: Flags [.], ack 35137, win 32768, options [TS val 5907 ecr 5752,sack 1 {35673:38889}], length 0
5.958077 Acknowledgment RA:00:00:00:00:00:06 
5.959005 IP 10.1.3.4.8080 > 10.1.2.3.49153: Flags [.], ack 35137, win 32768, options [TS val 5908 ecr 5752,sack 1 {35673:39425}], length 0
5.959021 Acknowledgment RA:00:00:00:00:00:06 
5.959083 IP 10.1.2.3.49153 > 10.1.3.4.8080: Flags [.], seq 39425:39961, ack 1, win 32768, options [TS val 5959 ecr 5908,eol], length 536: HTTP
5.959243 Acknowledgment RA:00:00:00:00:00:05 
6.006433 Beacon (ns-3-ssid) [6.0* 9.0 12.0* 18.0 24.0* 36.0 48.0 54.0 Mbit] ESS
6.055650 IP 10.1.3.4.8080 > 10.1.2.3.49153: Flags [.], ack 39425, win 32768, options [TS val 6005 ecr 5954,eol], length 0
6.055666 Acknowledgment RA:00:00:00:00:00:06 
6.055728 IP 10.1.2.3.49153 > 10.1.3.4.8080: Flags [.], seq 39961:40497, ack 1, win 32768, options [TS val 6055 ecr 6005,eol], length 536: HTTP
6.055888 Acknowledgment RA:00:00:00:00:00:05 
6.108833 Beacon (ns-3-ssid) [6.0* 9.0 12.0* 18.0 24.0* 36.0 48.0 54.0 Mbit] ESS
6.157021 IP 10.1.3.4.8080 > 10.1.2.3.49153: Flags [.], ack 40497, win 32768, options [TS val 6106 ecr 5959,eol], length 0
6.157037 Acknowledgment RA:00:00:00:00:00:06 
6.157099 IP 10.1.2.3.49153 > 10.1.3.4.8080: Flags [.], seq 40497:41033, ack 1, win 32768, options [TS val 6157 ecr 6106,eol], length 536: HTTP
6.157259 Acknowledgment RA:00:00:00:00:00:05 
6.157401 IP 10.1.2.3.49153 > 10.1.3.4.8080: Flags [.], seq 41033:41569, ack 1, win 32768, options [TS val 6157 ecr 6106,eol], length 536: HTTP
6.157561 Acknowledgment RA:00:00:00:00:00:05 
6.211233 Beacon (ns-3-ssid) [6.0* 9.0 12.0* 18.0 24.0* 36.0 48.0 54.0 Mbit] ESS
6.259335 IP 10.1.3.4.8080 > 10.1.2.3.49153: Flags [.], ack 41569, win 32768, options [TS val 6209 ecr 6157,eol], length 0
6.259351 Acknowledgment RA:00:00:00:00:00:06 
6.259413 IP 10.1.2.3.49153 > 10.1.3.4.8080: Flags [.], seq 41569:42105, ack 1, win 32768, options [TS val 6259 ecr 6209,eol], length 536: HTTP
6.259573 Acknowledgment RA:00:00:00:00:00:05 
6.259706 IP 10.1.2.3.49153 > 10.1.3.4.8080: Flags [.], seq 42105:42641, ack 1, win 32768, options [TS val 6259 ecr 6209,eol], length 536: HTTP
6.259866 Acknowledgment RA:00:00:00:00:00:05 
6.259972 IP 10.1.2.3.49153 > 10.1.3.4.8080: Flags [.], seq 42641:43177, ack 1, win 32768, options [TS val 6259 ecr 6209,eol], length 536: HTTP
6.260132 Acknowledgment RA:00:00:00:00:00:05 
6.313633 Beacon (ns-3-ssid) [6.0* 9.0 12.0* 18.0 24.0* 36.0 48.0 54.0 Mbit] ESS
6.361650 IP 10.1.3.4.8080 > 10.1.2.3.49153: Flags [.], ack 42641, win 32768, options [TS val 6311 ecr 6259,eol], length 0
6.361666 Acknowledgment RA:00:00:00:00:00:06 
6.361728 IP 10.1.2.3.49153 > 10.1.3.4.8080: Flags [.], seq 43177:43713, ack 1, win 32768, options [TS val 6361 ecr 6311,eol], length 536: HTTP
6.361888 Acknowledgment RA:00:00:00:00:00:05 
6.362048 IP 10.1.2.3.49153 > 10.1.3.4.8080: Flags [.], seq 43713:44249, ack 1, win 32768, options [TS val 6361 ecr 6311,eol], length 536: HTTP
6.362208 Acknowledgment RA:00:00:00:00:00:05 
6.416033 Beacon (ns-3-ssid) [6.0* 9.0 12.0* 18.0 24.0* 36.0 48.0 54.0 Mbit] ESS
6.463021 IP 10.1.3.4.8080 > 10.1.2.3.49153: Flags [.], ack 43713, win 32768, options [TS val 6412 ecr 6259,eol], length 0
6.463037 Acknowledgment RA:00:00:00:00:00:06 
6.463099 IP 10.1.2.3.49153 > 10.1.3.4.8080: Flags [.], seq 44249:44785, ack 1, win 32768, options [TS val 6463 ecr 6412,eol], length 536: HTTP
6.463259 Acknowledgment RA:00:00:00:00:00:05 
6.463419 IP 10.1.2.3.49153 > 10.1.3.4.8080: Flags [.], seq 44785:45321, ack 1, win 32768, options [TS val 6463 ecr 6412,eol], length 536: HTTP
6.463579 Acknowledgment RA:00:00:00:00:00:05 
6.518433 Beacon (ns-3-ssid) [6.0* 9.0 12.0* 18.0 24.0* 36.0 48.0 54.0 Mbit] ESS
6.564391 IP 10.1.3.4.8080 > 10.1.2.3.49153: Flags [.], ack 44785, win 32768, options [TS val 6514 ecr 6361,eol], length 0
6.564407 Acknowledgment RA:00:00:00:00:00:06 
6.564469 IP 10.1.2.3.49153 > 10.1.3.4.8080: Flags [.], seq 45321:45857, ack 1, win 32768, options [TS val 6564 ecr 6514,eol], length 536: HTTP
6.564629 Acknowledgment RA:00:00:00:00:00:05 
6.564708 IP 10.1.2.3.49153 > 10.1.3.4.8080: Flags [.], seq 45857:46393, ack 1, win 32768, options [TS val 6564 ecr 6514,eol], length 536: HTTP
6.564868 Acknowledgment RA:00:00:00:00:00:05 
6.565019 IP 10.1.2.3.49153 > 10.1.3.4.8080: Flags [.], seq 46393:46929, ack 1, win 32768, options [TS val 6564 ecr 6514,eol], length 536: HTTP
6.565179 Acknowledgment RA:00:00:00:00:00:05 
6.620833 Beacon (ns-3-ssid) [6.0* 9.0 12.0* 18.0 24.0* 36.0 48.0 54.0 Mbit] ESS
6.665762 IP 10.1.3.4.8080 > 10.1.2.3.49153: Flags [.], ack 45857, win 32768, options [TS val 6615 ecr 6463,eol], length 0
6.665778 Acknowledgment RA:00:00:00:00:00:06 
6.665840 IP 10.1.2.3.49153 > 10.1.3.4.8080: Flags [.], seq 46929:47465, ack 1, win 32768, options [TS val 6665 ecr 6615,eol], length 536: HTTP
6.666000 Acknowledgment RA:00:00:00:00:00:05 
6.666133 IP 10.1.2.3.49153 > 10.1.3.4.8080: Flags [.], seq 47465:48001, ack 1, win 32768, options [TS val 6665 ecr 6615,eol], length 536: HTTP
6.666293 Acknowledgment RA:00:00:00:00:00:05 
6.667663 IP 10.1.3.4.8080 > 10.1.2.3.49153: Flags [.], ack 45857, win 32768, options [TS val 6617 ecr 6463,sack 1 {46393:46929}], length 0
6.667679 Acknowledgment RA:00:00:00:00:00:06 
6.667741 IP 10.1.2.3.49153 > 10.1.3.4.8080: Flags [.], seq 48001:48537, ack 1, win 32768, options [TS val 6667 ecr 6617,eol], length 536: HTTP
6.667901 Acknowledgment RA:00:00:00:00:00:05 
6.723233 Beacon (ns-3-ssid) [6.0* 9.0 12.0* 18.0 24.0* 36.0 48.0 54.0 Mbit] ESS
6.767142 IP 10.1.3.4.8080 > 10.1.2.3.49153: Flags [.], ack 45857, win 32768, options [TS val 6716 ecr 6463,sack 1 {46393:47465}], length 0
6.767158 Acknowledgment RA:00:00:00:00:00:06 
6.767220 IP 10.1.2.3.49153 > 10.1.3.4.8080: Flags [.], seq 48537:49073, ack 1, win 32768, options [TS val 6767 ecr 6716,eol], length 536: HTTP
6.767380 Acknowledgment RA:00:00:00:00:00:05 
6.768086 IP 10.1.3.4.8080 > 10.1.2.3.49153: Flags [.], ack 45857, win 32768, options [TS val 6717 ecr 6463,sack 1 {46393:48001}], length 0
6.768102 Acknowledgment RA:00:00:00:00:00:06 
6.768164 IP 10.1.2.3.49153 > 10.1.3.4.8080: Flags [.], seq 45857:46393, ack 1, win 32768, options [TS val 6768 ecr 6717,eol], length 536: HTTP
6.768324 Acknowledgment RA:00:00:00:00:00:05 
6.825633 Beacon (ns-3-ssid) [6.0* 9.0 12.0* 18.0 24.0* 36.0 48.0 54.0 Mbit] ESS
6.868536 IP 10.1.3.4.8080 > 10.1.2.3.49153: Flags [.], ack 45857, win 32768, options [TS val 6818 ecr 6463,sack 2 {48537:49073}{46393:48001}], length 0
6.868552 Acknowledgment RA:00:00:00:00:00:06 
6.928033 Beacon (ns-3-ssid) [6.0* 9.0 12.0* 18.0 24.0* 36.0 48.0 54.0 Mbit] ESS
7.030433 Beacon (ns-3-ssid) [6.0* 9.0 12.0* 18.0 24.0* 36.0 48.0 54.0 Mbit] ESS
7.132833 Beacon (ns-3-ssid) [6.0* 9.0 12.0* 18.0 24.0* 36.0 48.0 54.0 Mbit] ESS
7.235233 Beacon (ns-3-ssid) [6.0* 9.0 12.0* 18.0 24.0* 36.0 48.0 54.0 Mbit] ESS
7.337633 Beacon (ns-3-ssid) [6.0* 9.0 12.0* 18.0 24.0* 36.0 48.0 54.0 Mbit] ESS
7.440033 Beacon (ns-3-ssid) [6.0* 9.0 12.0* 18.0 24.0* 36.0 48.0 54.0 Mbit] ESS
7.542433 Beacon (ns-3-ssid) [6.0* 9.0 12.0* 18.0 24.0* 36.0 48.0 54.0 Mbit] ESS
7.644833 Beacon (ns-3-ssid) [6.0* 9.0 12.0* 18.0 24.0* 36.0 48.0 54.0 Mbit] ESS
7.665796 IP 10.1.2.3.49153 > 10.1.3.4.8080: Flags [.], seq 45857:46393, ack 1, win 32768, options [TS val 7665 ecr 6818,eol], length 536: HTTP
7.665956 Acknowledgment RA:00:00:00:00:00:05 
7.747233 Beacon (ns-3-ssid) [6.0* 9.0 12.0* 18.0 24.0* 36.0 48.0 54.0 Mbit] ESS
7.767098 IP 10.1.3.4.8080 > 10.1.2.3.49153: Flags [.], ack 48001, win 32768, options [TS val 7716 ecr 7665,sack 1 {48537:49073}], length 0
7.767114 Acknowledgment RA:00:00:00:00:00:06 
7.767176 IP 10.1.2.3.49153 > 10.1.3.4.8080: Flags [.], seq 48001:48537, ack 1, win 32768, options [TS val 7767 ecr 7716,eol], length 536: HTTP
7.767336 Acknowledgment RA:00:00:00:00:00:05 
7.767451 IP 10.1.2.3.49153 > 10.1.3.4.8080: Flags [.], seq 49073:49609, ack 1, win 32768, options [TS val 7767 ecr 7716,eol], length 536: HTTP
7.767611 Acknowledgment RA:00:00:00:00:00:05 
7.849633 Beacon (ns-3-ssid) [6.0* 9.0 12.0* 18.0 24.0* 36.0 48.0 54.0 Mbit] ESS
7.868461 IP 10.1.3.4.8080 > 10.1.2.3.49153: Flags [.], ack 49073, win 32768, options [TS val 7818 ecr 7767,eol], length 0
7.868477 Acknowledgment RA:00:00:00:00:00:06 
7.868539 IP 10.1.2.3.49153 > 10.1.3.4.8080: Flags [.], seq 49609:50145, ack 1, win 32768, options [TS val 7868 ecr 7818,eol], length 536: HTTP
7.868699 Acknowledgment RA:00:00:00:00:00:05 
7.952033 Beacon (ns-3-ssid) [6.0* 9.0 12.0* 18.0 24.0* 36.0 48.0 54.0 Mbit] ESS
8.054433 Beacon (ns-3-ssid) [6.0* 9.0 12.0* 18.0 24.0* 36.0 48.0 54.0 Mbit] ESS
8.069404 IP 10.1.3.4.8080 > 10.1.2.3.49153: Flags [.], ack 49609, win 32768, options [TS val 8019 ecr 7767,eol], length 0
8.069420 Acknowledgment RA:00:00:00:00:00:06 
8.069482 IP 10.1.2.3.49153 > 10.1.3.4.8080: Flags [.], seq 50145:50681, ack 1, win 32768, options [TS val 8069 ecr 8019,eol], length 536: HTTP
8.069642 Acknowledgment RA:00:00:00:00:00:05 
8.156833 Beacon (ns-3-ssid) [6.0* 9.0 12.0* 18.0 24.0* 36.0 48.0 54.0 Mbit] ESS
8.170784 IP 10.1.3.4.8080 > 10.1.2.3.49153: Flags [.], ack 49609, win 32768, options [TS val 8120 ecr 7767,sack 1 {50145:50681}], length 0
8.170800 Acknowledgment RA:00:00:00:00:00:06 
8.170862 IP 10.1.2.3.49153 > 10.1.3.4.8080: Flags [.], seq 50681:51217, ack 1, win 32768, options [TS val 8170 ecr 8120,eol], length 536: HTTP
8.171022 Acknowledgment RA:00:00:00:00:00:05 
8.259233 Beacon (ns-3-ssid) [6.0* 9.0 12.0* 18.0 24.0* 36.0 48.0 54.0 Mbit] ESS
8.272164 IP 10.1.3.4.8080 > 10.1.2.3.49153: Flags [.], ack 49609, win 32768, options [TS val 8221 ecr 7767,sack 1 {50145:51217}], length 0
8.272180 Acknowledgment RA:00:00:00:00:00:06 
8.272242 IP 10.1.2.3.49153 > 10.1.3.4.8080: Flags [.], seq 51217:51753, ack 1, win 32768, options [TS val 8272 ecr 8221,eol], length 536: HTTP
8.272402 Acknowledgment RA:00:00:00:00:00:05 
8.361633 Beacon (ns-3-ssid) [6.0* 9.0 12.0* 18.0 24.0* 36.0 48.0 54.0 Mbit] ESS
8.373544 IP 10.1.3.4.8080 > 10.1.2.3.49153: Flags [.], ack 49609, win 32768, options [TS val 8323 ecr 7767,sack 1 {50145:51753}], length 0
8.373560 Acknowledgment RA:00:00:00:00:00:06 
